question_id,kla,session,question_number,question_type,date,ministry,title_mal,mla_names,question_body_mal,answer_pdf_url,source_url,mla_name_eng,mla_party_eng,mla_constituency_eng,mla_party_mal,mla_constituency_mal
15-16-236,15,16,236,starred,2026-02-24,starred,പട്ടികവര്‍ഗ്ഗ വിഭാഗത്തിന്റെ പഠന പിന്നാക്കാവസ്ഥ പരിഹരിക്കുന്നതിന് സമഗ്ര കര്‍മ്മപദ്ധതി,"ശ്രീ വി ശശി | ശ്രീ ജി എസ് ജയലാൽ | ശ്രീ . മുഹമ്മദ് മുഹസിൻ : താഴെ കാണുന്ന ചോദ്യങ്ങൾക്കു പട്ടിക ജാതി, പട്ടിക വർഗ്ഗ, പിന്നാക്ക വിഭാഗ ക്ഷേമ വകുപ്പ് മന്ത്രി സദയം മറുപടി പറയാമോ? ( എ ) പട്ടികവര്‍ഗ്ഗ വിഭാഗത്തിലെ സ്കൂള്‍ വിദ്യാര്‍ത്ഥികളുടെ പഠന പിന്നാക്കാവസ്ഥ ഉൾപ്പെടെയുള്ള പ്രശ്നങ്ങള്‍ പരിഹരിക്കുന്നതിനായി സമഗ്ര കര്‍മ്മപദ്ധതിക്ക് രൂപം നല്‍കിയിട്ടുണ്ടോ; വ്യക്തമാക്കാമോ; ( ബി ) പട്ടികവര്‍ഗ്ഗ വിദ്യാര്‍ത്ഥികളുടെ സാര്‍വത്രിക എന്‍റോള്‍മെന്റ് ഉറപ്പാക്കുന്നതിനും അവരെ തുടര്‍ച്ചയായി സ്കൂളില്‍ നിലനിര്‍ത്തുന്നതിനും വേണ്ടി എന്തെല്ലാം കർമ്മപദ്ധതികളാണ് നടപ്പിലാക്കിയിട്ടുള്ളത്; വിശദീകരിക്കുമോ; ( സി ) പട്ടികവര്‍ഗ്ഗ വിദ്യാര്‍ത്ഥികളുടെ വിജയശതമാനം മെച്ചപ്പെടുത്തുന്നതിനും ഉന്നതവിദ്യാഭ്യാസം നേടുന്നവരുടെ എണ്ണം വർദ്ധിപ്പിക്കുന്നതിനും വേണ്ടി സർക്കാർ നടപ്പിലാക്കിയിട്ടുള്ള പദ്ധതികൾ എന്തെല്ലാമെന്ന് വിശദമാക്കുമോ; ( ഡി ) ആദിവാസി മേഖലകളിലെ വിദ്യാഭ്യാസസ്ഥാപനങ്ങളുടെ പഠനനിലവാരം മെച്ചപ്പെടുത്തുന്നതിനുവേണ്ടി സ്വീകരിച്ചിട്ടുള്ള നടപടികൾ എന്തെല്ലാം; വിശദീകരിക്കുമോ? ഉള്‍നാടന്‍ മത്സ്യകൃഷിയിലൂടെ ലക്ഷ്യമിടുന്ന ഉല്‍പ്പാദനം",,http://www.niyamasabha.org/codes/15kla/Session_16/ans/s00236-230226-16-15.pdf,http://www.niyamasabha.org/codes/15kla/Session_16/qns/html/s_240226(211-240).html,V Sasi,Communist Party Of India,Chirayinkeezhu,കമ്മ്യൂണിസ്റ്റ് പാർട്ടി ഓഫ് ഇന്ത്യ,ചിറയിൻകീഴ്
15-16-237,15,16,237,starred,2026-02-24,starred,ഉള്‍നാടന്‍ മത്സ്യകൃഷിയിലൂടെ ലക്ഷ്യമിടുന്ന ഉല്‍പ്പാദനം,"ശ്രീമതി ദെലീമ ശ്രീ. എം. എം. മണി ശ്രീ. കെ.കെ. രാമചന്ദ്രൻ | ശ്രീ ജി സ്റ്റീഫന്‍ : താഴെ കാണുന്ന ചോദ്യങ്ങൾക്കു മത്സ്യബന്ധനം, സാംസ്കാരികം, യുവജനകാര്യ വകുപ്പ് മന്ത്രി സദയം മറുപടി പറയാമോ? ( എ ) തണ്ണീര്‍ തടങ്ങളിലും തരിശ് പാടങ്ങളിലും മത്സ്യകൃഷി പ്രാവര്‍ത്തികമാക്കുന്നതിന് എന്തെല്ലാം പദ്ധതികൾ ആവിഷ്കരിച്ചിട്ടുണ്ടെന്ന് വിശദമാക്കാമോ; ( ബി ) 2026-27 സാമ്പത്തിക വര്‍ഷം കൂടുതലായി എത്ര ഹെക്ടറിലാണ് മത്സ്യകൃഷി വ്യാപിപ്പിക്കാന്‍ ഉദ്ദേശിക്കുന്നതെന്ന് വ്യക്തമാക്കാമോ; ( സി ) വാണിജ്യ മൂല്യമേറിയ ഇനം മത്സ്യങ്ങളുടെ ഉല്‍പ്പാദനം വര്‍ദ്ധിപ്പിക്കുന്നതിനുള്ള പദ്ധതികള്‍ ആവിഷ്കരിച്ചിട്ടുണ്ടോ; വ്യക്തമാക്കാമോ; ( ഡി ) 2030 വർഷത്തോടെ ഉള്‍നാടന്‍ മത്സ്യകൃഷിയിലൂടെ ലക്ഷ്യമിടുന്ന ഉല്‍പ്പാദനം എത്രയെന്ന് വിശദമാക്കാമോ? ആദിവാസി ക്ഷേമ ശാക്തീകരണ പദ്ധതി",,http://www.niyamasabha.org/codes/15kla/Session_16/ans/s00237-230226-16-15.pdf,http://www.niyamasabha.org/codes/15kla/Session_16/qns/html/s_240226(211-240).html,,,,,
15-16-238,15,16,238,starred,2026-02-24,starred,ആദിവാസി ക്ഷേമ ശാക്തീകരണ പദ്ധതി,"ശ്രീ. കെ. ബാബു (തൃപ്പൂണിത്തുറ) | ശ്രീമതി ഉമ തോമസ് ശ്രീ. ടി. ജെ. വിനോദ് ശ്രീ. സി. ആര്‍. മഹേഷ് : താഴെ കാണുന്ന ചോദ്യങ്ങൾക്കു പട്ടിക ജാതി, പട്ടിക വർഗ്ഗ, പിന്നാക്ക വിഭാഗ ക്ഷേമ വകുപ്പ് മന്ത്രി സദയം മറുപടി പറയാമോ? ( എ ) ആദിവാസി ശാക്തീകരണത്തിനായി 1996-ൽ പാർലമെന്റ് പാസാക്കിയ 'പെസ' നിയമം സംസ്ഥാനത്ത് നടപ്പിലാക്കാൻ സ്വീകരിച്ച നടപടികൾ വ്യക്തമാക്കാമോ; ( ബി ) ആദിവാസി ക്ഷേമ ശാക്തീകരണ പദ്ധതികളിൽ വലിയ തോതിൽ ഫണ്ട് വിനിയോഗം നടക്കുന്നുണ്ടെങ്കിലും പദ്ധതികൾ ലക്ഷ്യപ്രാപ്തിയിൽ എത്താത്തതിന്റെ കാരണത്തെക്കുറിച്ച് സർക്കാർ പഠനം നടത്തി തിരുത്തൽ നടപടി സ്വീകരിക്കുമോ; വ്യക്തമാക്കുമോ; ( സി ) ആദിവാസി ഊരുകളുടെ പശ്ചാത്തല സൗകര്യങ്ങള്‍ മെച്ചപ്പെടുത്തുന്നതിനായി സമഗ്രമായ കർമ്മ പദ്ധതി ആവിഷ്കരിച്ച് നടപ്പാക്കുമോ; വ്യക്തമാക്കുമോ? ആദിവാസി ഗോത്ര മേഖലയുടെ സമഗ്ര ശാക്തീകരണം",,http://www.niyamasabha.org/codes/15kla/Session_16/ans/s00238-230226-16-15.pdf,http://www.niyamasabha.org/codes/15kla/Session_16/qns/html/s_240226(211-240).html,,,,,
15-16-239,15,16,239,starred,2026-02-24,starred,ആദിവാസി ഗോത്ര മേഖലയുടെ സമഗ്ര ശാക്തീകരണം,"ശ്രീ. ടി.ഐ.മധുസൂദനന്‍ ശ്രീ. ടി. പി .രാമകൃഷ്ണൻ ശ്രീ. പി.പി. സുമോദ് ശ്രീ. കെ. ആൻസലൻ : താഴെ കാണുന്ന ചോദ്യങ്ങൾക്കു പട്ടിക ജാതി, പട്ടിക വർഗ്ഗ, പിന്നാക്ക വിഭാഗ ക്ഷേമ വകുപ്പ് മന്ത്രി സദയം മറുപടി പറയാമോ? ( എ ) 2016-2021, 2021-2026 കാലയളവിൽ ആദിവാസി ഗോത്ര വിഭാഗത്തിന് വ്യക്തിഗതാവകാശം വഴിയും സാമൂഹിക അവകാശം വഴിയും എത്ര ഏക്കര്‍ ഭൂമി ലഭ്യമായിട്ടുണ്ട്; വിശദമാക്കാമോ; ( ബി ) പ്രസ്തുത ഭൂമി ഉപയോഗപ്പെടുത്തി ഗോത്ര മേഖലയുടെ സമഗ്ര ശാക്തീകരണം സാധ്യമാക്കുന്നതിന് എന്തെല്ലാം നടപടികളാണ് സ്വീകരിക്കുവാന്‍ ഉദ്ദേശിക്കുന്നത്; വ്യക്തമാക്കാമോ; ( സി ) വനവും വനവിഭവങ്ങളും സംരക്ഷിച്ചുകൊണ്ടും അവ ഉപയോഗപ്പെടുത്തി മൂല്യവല്‍കൃത വിപണി ഉയര്‍ത്തിക്കൊണ്ടും ആദിവാസി ജനതയെ സംരക്ഷിക്കുന്നതിന് നടപടി സ്വീകരിക്കുമോ; വിശദമാക്കുമോ? ജലവിഭവം ശാശ്വതമായി ഉപയോഗിക്കുന്നതിനുള്ള പദ്ധതികള്‍",,http://www.niyamasabha.org/codes/15kla/Session_16/ans/s00239-230226-16-15.pdf,http://www.niyamasabha.org/codes/15kla/Session_16/qns/html/s_240226(211-240).html,,,,,
15-16-240,15,16,240,starred,2026-02-24,starred,ജലവിഭവം ശാശ്വതമായി ഉപയോഗിക്കുന്നതിനുള്ള പദ്ധതികള്‍,"ശ്രീ. പി.വി. ശ്രീനിജിൻ ശ്രീ. കെ. ബാബു (നെന്മാറ) | ശ്രീ ഡി കെ മുരളി : താഴെ കാണുന്ന ചോദ്യങ്ങൾക്കു ജലവിഭവ വകുപ്പ് മന്ത്രി സദയം മറുപടി പറയാമോ? ( എ ) കേരളത്തിലെ പ്രധാന ജലസംഭരണികളില്‍ ജലനിരപ്പ് നിരീക്ഷിക്കുന്നതിനുള്ള സാങ്കേതിക സംവിധാനങ്ങള്‍ എന്തൊക്കെയെന്ന് വിശദമാക്കാമോ; ( ബി ) ഭാവിയില്‍ ജലവിഭവത്തെ കൂടുതല്‍ ശാശ്വതമായി ഉപയോഗിക്കുന്നതിനുള്ള സർക്കാർ പദ്ധതികള്‍ എന്തൊക്കെയെന്ന് വിശദമാക്കാമോ? Website maintained by Information System Section, Kerala Legislative Assembly, Thiruvananthapuram.",,http://www.niyamasabha.org/codes/15kla/Session_16/ans/s00240-230226-16-15.pdf,http://www.niyamasabha.org/codes/15kla/Session_16/qns/html/s_240226(211-240).html,,,,,
15-16-91,15,16,91,starred,2026-02-03,starred,സാഹസിക വിനോദസഞ്ചാരം,ഡോ. എം. കെ. മുനീർ ശ്രീ. പി. കെ. ബഷീർ ശ്രീ. എൻ. ഷംസുദ്ദീൻ ശ്രീ. മഞ്ഞളാംകുഴി അലി : താഴെ കാണുന്ന ചോദ്യങ്ങൾക്കു പൊതുമരാമത്ത്-വിനോദസഞ്ചാര വകുപ്പ് മന്ത്രി സദയം മറുപടി പറയാമോ? ( എ ) സംസ്ഥാനത്ത് സാഹസിക വിനോദസഞ്ചാരം പ്രോത്സാഹിപ്പിക്കുന്നതിന് എന്തെല്ലാം നടപടികളാണ് സ്വീകരിച്ചു വരുന്നത്; വിശദമാക്കുമോ; ( ബി ) ഏതെല്ലാം മേഖലകളിലാണ് സാഹസിക ടൂറിസം ​കേന്ദ്രങ്ങൾ പ്രവർത്തിച്ചു വരുന്നത്; ( സി ) പ്രസ്തുത കേന്ദ്രങ്ങളിൽ സുരക്ഷാക്രമീകരണങ്ങൾ പാലിക്കുന്നുണ്ടോയെന്ന് പരിശോധിക്കാറുണ്ടോ; സഞ്ചാരികളുടെ സുരക്ഷിതത്വം ഉറപ്പാക്കാൻ എന്തെല്ലാം നടപടികളാണ് സ്വീകരിക്കാൻ ഉദ്ദേശിക്കുന്നതെന്ന് വിശദമാക്കുമോ? ലെവല്‍ ക്രോസ് ഇല്ലാത്ത കേരളം പദ്ധതി,,http://www.niyamasabha.org/codes/15kla/Session_16/ans/s00091-030226-16-15.pdf,http://www.niyamasabha.org/codes/15kla/Session_16/qns/html/s_030226(91-120).html,,,,,
15-16-92,15,16,92,starred,2026-02-03,starred,ലെവല്‍ ക്രോസ് ഇല്ലാത്ത കേരളം പദ്ധതി,"ശ്രീ. കെ. ജെ. മാക്‌സി | ശ്രീ ഡി കെ മുരളി ശ്രീ. പി. മമ്മിക്കുട്ടി ശ്രീ. സേവ്യര്‍ ചിറ്റിലപ്പിള്ളി : താഴെ കാണുന്ന ചോദ്യങ്ങൾക്കു പൊതുമരാമത്ത്-വിനോദസഞ്ചാര വകുപ്പ് മന്ത്രി സദയം മറുപടി പറയാമോ? ( എ ) ലെവല്‍ ക്രോസ് ഇല്ലാത്ത കേരളം പദ്ധതി വഴി പൂര്‍ത്തീകരിച്ച മേല്‍പ്പാലങ്ങളുടെ വിവരങ്ങള്‍, നിര്‍മ്മാണത്തിലിരിക്കുന്ന പാലങ്ങളുടെ പ്രവൃത്തി പുരോഗതി എന്നിവ വ്യക്തമാക്കാമോ; ( ബി ) പൂര്‍ണ്ണമായും റെയില്‍വേ ഫണ്ടിംഗോടെ അനുമതി ലഭിച്ച മേല്‍പ്പാലങ്ങളുടെ നിര്‍മ്മാണ ചുമതലയെക്കുറിച്ചുള്ള വിവരങ്ങള്‍ ലഭ്യമാക്കാമോ; ( സി ) നിശ്ചിത സമയപരിധിക്കുള്ളില്‍ പാലങ്ങളുടെ നിര്‍മ്മാണം പൂര്‍ത്തിയാക്കാന്‍ പൊതുമരാമത്ത് വകുപ്പ് നടപ്പിലാക്കിയ കര്‍മ്മ പദ്ധതികള്‍ എന്തൊക്കെയാണെന്ന് വിശദമാക്കാമോ; ( ഡി ) റെയില്‍വേ മേല്‍പ്പാലങ്ങളുടെ നിര്‍മ്മാണത്തിനായി സംസ്ഥാന സര്‍ക്കാര്‍ ചെലവഴിച്ച തുകയുടെ വിശദാംശം ലഭ്യമാക്കാമോ? തൊഴിലുറപ്പ് നിയമ ഭേദഗതി",,http://www.niyamasabha.org/codes/15kla/Session_16/ans/s00092-030226-16-15.pdf,http://www.niyamasabha.org/codes/15kla/Session_16/qns/html/s_030226(91-120).html,K J Maxy,Communist Party Of India(Marxist),Kochi,കമ്മ്യൂണിസ്റ്റ് പാർട്ടി ഓഫ് ഇന്ത്യ (മാർക്സിസ്റ്റ്),കൊച്ചി
15-16-93,15,16,93,starred,2026-02-03,starred,തൊഴിലുറപ്പ് നിയമ ഭേദഗതി,ശ്രീ. പ്രമോദ് നാരായൺ ഡോ. എൻ. ജയരാജ് ശ്രീ. ജോബ് മൈക്കിള്‍ ശ്രീ. സെബാസ്റ്റ്യൻ കുളത്തുങ്കല്‍ : താഴെ കാണുന്ന ചോദ്യങ്ങൾക്കു പൊതുവിദ്യാഭ്യാസ-തൊഴിൽ വകുപ്പ് മന്ത്രി സദയം മറുപടി പറയാമോ? ( എ ) കേന്ദ്ര സര്‍ക്കാര്‍ തൊഴിലുറപ്പ് പദ്ധതിക്ക് നിശ്ചയിച്ച സൂചികയില്‍ ഏതെല്ലാം കാര്യങ്ങളിലാണ് സംസ്ഥാനം മുന്‍പിലെന്ന് അറിയിക്കുമോ; ( ബി ) സംസ്ഥാനത്തെ സംബന്ധിച്ച് പരിഷ്കരിക്കപ്പെട്ട തൊഴിലുറപ്പ് നിയമത്തിൽ എന്തെല്ലാം പ്രതികൂല വ്യവസ്ഥകളാണ് ഉള്‍പ്പെടുന്നതെന്ന് അറിയിക്കുമോ; ( സി ) പുതിയ വ്യവസ്ഥകള്‍ പ്രകാരം പ്രതിവര്‍ഷം അധിക കടബാധ്യത കണക്കാക്കിയിട്ടുണ്ടോ; വിശദാംശം നല്‍കുമോ; ( ഡി ) മുന്‍കാലങ്ങളി‍ല്‍ സംസ്ഥാനത്തിനുള്ള ലേബർ ബജറ്റില്‍ കേന്ദ്ര സർക്കാർ കുറവ് വരുത്തിയത് മറികടക്കുന്നതിന് എന്തെല്ലാം നടപടിയാണ് സ്വീകരിച്ചതെന്ന് വ്യക്തമാക്കുമോ? കോഴിക്കോട്-വയനാട് തുരങ്കപാത,,http://www.niyamasabha.org/codes/15kla/Session_16/ans/s00093-030226-16-15.pdf,http://www.niyamasabha.org/codes/15kla/Session_16/qns/html/s_030226(91-120).html,,,,,
15-16-94,15,16,94,starred,2026-02-03,starred,കോഴിക്കോട്-വയനാട് തുരങ്കപാത,ശ്രീ. കെ. എം. സച്ചിന്‍ദേവ് ശ്രീ. ടി. പി .രാമകൃഷ്ണൻ ശ്രീ. പി. ടി. എ. റഹീം ശ്രീ. ടി.ഐ.മധുസൂദനന്‍ : താഴെ കാണുന്ന ചോദ്യങ്ങൾക്കു പൊതുമരാമത്ത്-വിനോദസഞ്ചാര വകുപ്പ് മന്ത്രി സദയം മറുപടി പറയാമോ? ( എ ) ആനക്കാംപൊയില്‍-കള്ളാടി-മേപ്പാടി തുരങ്കപാതയുടെ നിര്‍മ്മാണത്തിനായി കിഫ്ബി പദ്ധതിയില്‍ ഉള്‍പ്പെടുത്തി അനുവദിച്ച തുകയുടെ വിശദാംശം നല്‍കാമോ; ( ബി ) സംസ്ഥാന സര്‍ക്കാരിന്റെ നേരിട്ടുള്ള നിയന്ത്രണത്തില്‍ നടപ്പിലാക്കുന്ന ആദ്യ തുരങ്കപാത നിര്‍മ്മാണത്തിന്റെ നിലവിലെ പുരോഗതി വിശദമാക്കാമോ; ( സി ) പ്രസ്തുത പ്രവൃത്തി യാഥാര്‍ത്ഥ്യമാക്കുന്നതിലൂടെ മലയോര മേഖലയിലെ ഗതാഗത സൗകര്യങ്ങളില്‍ എന്തെല്ലാം മാറ്റങ്ങളാണ് പ്രതീക്ഷിക്കുന്നതെന്ന് വിശദമാക്കാമോ; ( ഡി ) പ്രസ്തുത പദ്ധതിയ്ക്കായി അനുവദിച്ച തുകയിൽ എത്ര തുക വിനിയോഗിച്ചുവെന്ന വിവരം ലഭ്യമാക്കാമോ? പാഠപുസ്തകങ്ങളില്‍ വരുത്തിയ പ്രധാനപ്പെട്ട മാറ്റങ്ങൾ,,http://www.niyamasabha.org/codes/15kla/Session_16/ans/s00094-030226-16-15.pdf,http://www.niyamasabha.org/codes/15kla/Session_16/qns/html/s_030226(91-120).html,,,,,
15-16-95,15,16,95,starred,2026-02-03,starred,പാഠപുസ്തകങ്ങളില്‍ വരുത്തിയ പ്രധാനപ്പെട്ട മാറ്റങ്ങൾ,ശ്രീമതി കെ. കെ. ശൈലജ ടീച്ചർ ശ്രീ. ഐ. ബി. സതീഷ് | ശ്രീ എം എസ് അരുൺ കുമാര്‍ ശ്രീ. പി.വി. ശ്രീനിജിൻ : താഴെ കാണുന്ന ചോദ്യങ്ങൾക്കു പൊതുവിദ്യാഭ്യാസ-തൊഴിൽ വകുപ്പ് മന്ത്രി സദയം മറുപടി പറയാമോ? ( എ ) 2023-24 അധ്യയന വര്‍ഷം മുതല്‍ ഭരണഘടനയുമായി ബന്ധപ്പെട്ട് പാഠപുസ്തകങ്ങളില്‍ വരുത്തിയ പ്രധാനപ്പെട്ട കൂട്ടിച്ചേര്‍ക്കലുകള്‍ എന്തൊക്കെയാണ്; വ്യക്തമാക്കുമോ; ( ബി ) കുട്ടികളിൽ വിമര്‍ശനാത്മക ചിന്ത വളര്‍ത്തുന്നതിനായി പാഠപുസ്തകങ്ങളില്‍ സ്വീകരിച്ചിട്ടുള്ള സമീപനം എങ്ങനെയുള്ളതാണ്; വിശദമാക്കുമോ; ( സി ) പരീക്ഷകളില്‍ കേവലം ഓര്‍മ്മശക്തി പരീക്ഷിക്കുക എന്നതിന് പകരം വിശകലനശേഷിയും ചിന്താശേഷിയും വളര്‍ത്തുന്നതിനുള്ള സമീപനം സ്വീകരിച്ചിട്ടുണ്ടോ; വിശദമാക്കാമോ; ( ഡി ) ഫിന്‍ലാന്റ് മാതൃകയിലുള്ള വിദ്യാഭ്യാസ രീതിയില്‍ നിന്ന് കേരളം ഉള്‍ക്കൊള്ളാന്‍ ശ്രമിക്കുന്ന പ്രധാന മാതൃകകള്‍ എന്താണെന്ന് വ്യക്തമാക്കാമോ; ( ഇ ) വിദ്യാകിരണം മിഷന്‍ എന്നതുകൊണ്ട് ലക്ഷ്യമിടുന്നത് എന്താണെന്ന് വിശദമാക്കാമോ? പുതുക്കിയ തൊഴിൽ കോഡുകൾ പഠിക്കാന്‍ വിദഗ്ദ്ധ സമിതി,,http://www.niyamasabha.org/codes/15kla/Session_16/ans/s00095-030226-16-15.pdf,http://www.niyamasabha.org/codes/15kla/Session_16/qns/html/s_030226(91-120).html,,,,,
