question_id,kla,session,question_number,question_type,date,ministry,title_mal,mla_names,question_body_mal,answer_pdf_url,source_url,mla_name_eng,mla_party_eng,mla_constituency_eng,mla_party_mal,mla_constituency_mal
15-8-400,15,8,400,starred,2023-03-14,starred,ഹൈടെക് സ്കൂള്‍ പദ്ധതി,ശ്രീ. ടി.ഐ.മധുസൂദനന്‍ | ശ്രീ കടകംപള്ളി സുരേന്ദ്രന്‍ ശ്രീ. കെ.പി.കുഞ്ഞമ്മദ് കുട്ടി മാസ്റ്റര്‍ ശ്രീ. കെ. പ്രേംകുമാര്‍ : താഴെ കാണുന്ന ചോദ്യങ്ങൾക്കു പൊതുവിദ്യാഭ്യാസ-തൊഴിൽ വകുപ്പ് മന്ത്രി സദയം മറുപടി പറയാമോ? ( എ ) സംസ്ഥാനത്ത് ഹൈടെക് സ്കൂള്‍ പദ്ധതി ശാക്തീകരിക്കുന്നതിന്റെ ഭാഗമായി മുപ്പത്താറായിരത്തിലധികം ലാപ്‌ടോപ് കമ്പ്യൂട്ടറുകള്‍ ഈ അദ്ധ്യയന വര്‍ഷം തന്നെ ലഭ്യമാക്കാന്‍ നടപടിയെടുത്തിട്ടുണ്ടോ; വ്യക്തമാക്കുമോ; ( ബി ) ഹൈടെക് സ്കൂള്‍ പദ്ധതി പ്രകാരം ഉപകരണങ്ങള്‍ നല്‍കുന്നതോടൊപ്പം അവയുടെ ഫലപ്രദമായ വിനിയോഗവും കാര്യക്ഷമമായ പരിപാലനവും ഉറപ്പുവരുത്താന്‍ നടപടി സ്വീകരിച്ചിട്ടുണ്ടോയെന്ന് വ്യക്തമാക്കാമോ; ( സി ) പൊതുവിദ്യാഭ്യാസ മേഖല ആധുനികീകരിക്കുന്നതിനും ഇൻഫർമേഷൻ ആൻഡ് കമ്മ്യൂണിക്കേഷൻസ് ടെക്‌നോളജിയധിഷ്ഠിതമാക്കുന്നതിനും കേരള ഇന്‍ഫ്രാസ്ട്രക്ചര്‍ ആന്‍ഡ് ടെക്‌നോളജി ഫോര്‍ എഡ്യൂക്കേഷന്‍ നടത്തുന്ന പ്രവര്‍ത്തനങ്ങള്‍ വിശദമാക്കാമോ? പൊതുവിദ്യാഭ്യാസ രംഗത്തെ പ്രകടന മികവ് സൂചിക,,http://www.niyamasabha.org/codes/15kla/Session_8/ans/s00400-140323-08-15.pdf,http://www.niyamasabha.org/codes/15kla/Session_8/qns/html/s_140323(391-420).html,,,,,
15-8-401,15,8,401,starred,2023-03-14,starred,പൊതുവിദ്യാഭ്യാസ രംഗത്തെ പ്രകടന മികവ് സൂചിക,ശ്രീ. എം.വി.ഗോവിന്ദന്‍ മാസ്റ്റര്‍ ശ്രീ. പി. ടി. എ. റഹീം ശ്രീ. കെ.എം.സച്ചിന്‍ദേവ് | ശ്രീ എം എസ് അരുൺ കുമാര്‍ : താഴെ കാണുന്ന ചോദ്യങ്ങൾക്കു പൊതുവിദ്യാഭ്യാസ-തൊഴിൽ വകുപ്പ് മന്ത്രി സദയം മറുപടി പറയാമോ? ( എ ) കേന്ദ്ര വിദ്യാഭ്യാസ മന്ത്രാലയം പ്രസിദ്ധീകരിക്കുന്ന പൊതുവിദ്യാഭ്യാസ രംഗത്തെ പ്രകടന മികവ് സൂചികയില്‍ (പെര്‍ഫോമന്‍സ് ഗ്രേഡിംഗ് ഇന്‍ഡക്സ്) 2017-18 മുതല്‍ നാളിതുവരെ സംസ്ഥാനത്തിന് നിരന്തരമായി മികവ് പുലർത്താനായിട്ടുണ്ടോ; വ്യക്തമാക്കുമോ; ( ബി ) പ്രസ്തുത സൂചികയിലെ നിലവാര നിര്‍ണ്ണയത്തിനായി പരിഗണിക്കുന്ന എല്ലാ മേഖലകളിലും മികവ് പുലര്‍ത്താനായിട്ടുണ്ടോ; പ്രസ്തുത നേട്ടം അംഗീകരിക്കാന്‍ വൈമുഖ്യമുള്ള ചില കേന്ദ്രങ്ങള്‍ സംസ്ഥാനം രണ്ടാം നിരയിലാണെന്ന തെറ്റിദ്ധാരണാജനകമായ വാര്‍ത്ത സൃഷ്ടിച്ചതായി ശ്രദ്ധയില്‍പ്പെട്ടിട്ടുണ്ടോ; ( സി ) പാര്‍ശ്വവല്‍ക്കരണമില്ലാതെ എല്ലാവര്‍ക്കും മികച്ച വിദ്യാഭ്യാസമെന്ന സംസ്ഥാന ലക്ഷ്യം പൂര്‍ണ്ണതയിലെത്തുന്നുവെന്നതിന് കേന്ദ്ര സർക്കാർ പുറപ്പെടുവിച്ച വിദ്യാഭ്യാസ പ്രാപ്യത സൂചിക ഉപോത്ബലകമാകുന്നുണ്ടോ; ഈ ലക്ഷ്യപ്രാപ്തിക്കായി സംസ്ഥാനം നടത്തിയ പ്രവര്‍ത്തനങ്ങള്‍ എന്തെല്ലാമാണ്; വിശദമാക്കുമോ? പൊതുവിദ്യാലയങ്ങളില്‍ ഗ്രേഡിംഗ് സംവിധാനം,,http://www.niyamasabha.org/codes/15kla/Session_8/ans/s00401-140323-08-15.pdf,http://www.niyamasabha.org/codes/15kla/Session_8/qns/html/s_140323(391-420).html,,,,,
15-8-402,15,8,402,starred,2023-03-14,starred,പൊതുവിദ്യാലയങ്ങളില്‍ ഗ്രേഡിംഗ് സംവിധാനം,"ശ്രീ. സെബാസ്റ്റ്യൻ കുളത്തുങ്കല്‍ ശ്രീ. ജോബ് മൈക്കിള്‍ | ശ്രീ പ്രമോദ് നാരായൺ ഡോ. എൻ. ജയരാജ് : താഴെ കാണുന്ന ചോദ്യങ്ങൾക്കു പൊതുവിദ്യാഭ്യാസ-തൊഴിൽ വകുപ്പ് മന്ത്രി സദയം മറുപടി പറയാമോ? ( എ ) സംസ്ഥാനത്തെ പൊതുവിദ്യാലയങ്ങളില്‍ ഗ്രേഡിംഗ് സംവിധാനം ഏര്‍പ്പെടുത്താന്‍ ഉദ്ദേശിക്കുന്നുണ്ടോ; വിശദാംശം നല്‍കാമോ; ( ബി ) പ്രസ്തുത ഗ്രേഡിംഗ് കണക്കാക്കുന്നതിനുള്ള മാനദണ്ഡങ്ങള്‍, യോഗ്യതകള്‍ എന്നിവ വ്യക്തമാക്കുമോ; ( സി ) ഏത് ഏജന്‍സി മുഖേനയാണ് ഗ്രേഡിംഗ് പൂര്‍ത്തിയാക്കാന്‍ നിശ്ചയിച്ചിരിക്കുന്നത്; പ്രസ്തുത ഏജന്‍സിയുടെ മുന്‍പരിചയം എന്താണെന്ന് അറിയിക്കാമോ; ( ഡി ) ഇത്തരത്തില്‍ ഗ്രേഡിംഗ് ഏര്‍പ്പെടുത്തുന്നതില്‍ സര്‍ക്കാര്‍, എയ്ഡഡ്, അണ്‍ എയ്ഡഡ് എന്നീ വിഭാഗങ്ങളിലെ ഏതൊക്കെ വിദ്യാലയങ്ങള്‍ ഉള്‍പ്പെടുമെന്ന് അറിയിക്കാമോ? വിദ്യാകിരണം പദ്ധതി",,http://www.niyamasabha.org/codes/15kla/Session_8/ans/s00402-140323-08-15.pdf,http://www.niyamasabha.org/codes/15kla/Session_8/qns/html/s_140323(391-420).html,,,,,
15-8-403,15,8,403,starred,2023-03-14,starred,വിദ്യാകിരണം പദ്ധതി,"ശ്രീ വി കെ പ്രശാന്ത് | ശ്രീമതി കെ. കെ. ശൈലജ ടീച്ചർ ശ്രീ. തോട്ടത്തില്‍ രവീന്ദ്രന്‍ | ശ്രീ . കെ .ഡി .പ്രസേനൻ : താഴെ കാണുന്ന ചോദ്യങ്ങൾക്കു പൊതുവിദ്യാഭ്യാസ-തൊഴിൽ വകുപ്പ് മന്ത്രി സദയം മറുപടി പറയാമോ? ( എ ) സംസ്ഥാനത്ത് അടിസ്ഥാന സൗകര്യ വികസനത്തില്‍ കഴിഞ്ഞ ആറ് വര്‍ഷത്തെ പ്രവര്‍ത്തന ഫലമായി കൈവരിച്ച നേട്ടത്തിന്റെ അടിസ്ഥാനത്തിൽ അൺ എയ്ഡഡ്, സ്വകാര്യ വിദ്യാലയങ്ങളില്‍ നിന്നും ഇതര സിലബസ് വിദ്യാലയങ്ങളില്‍ നിന്നും വിദ്യാര്‍ത്ഥികളെ പൊതുവിദ്യാലയങ്ങളിലേക്ക് ആകര്‍ഷിക്കാനായിട്ടുണ്ടോ; വിശദാംശം ലഭ്യമാക്കുമോ; ( ബി ) പ്രസ്തുത നേട്ടം തുടരുന്നതിന് അക്കാദമിക മികവ് ലോകോത്തരമാക്കുകയെന്ന ലക്ഷ്യത്തോടെ വിദ്യാകിരണം പദ്ധതിയിലൂടെ നടത്തുന്ന പ്രവര്‍ത്തനങ്ങള്‍ എന്തെല്ലാമാണ്; വിശദമാക്കാമോ; ( സി ) കാലഘട്ടത്തിന് അനുസൃതമായ മികച്ച അദ്ധ്യാപനത്തിനായി അദ്ധ്യാപകരുടെ ശേഷി വികസനത്തിന് പദ്ധതിയുണ്ടോ; വ്യക്തമാക്കാമോ? വില്ലേജ് ഓഫീസുകളുടെ പ്രവർത്തനം സുതാര്യമാക്കാന്‍ നടപടി",,http://www.niyamasabha.org/codes/15kla/Session_8/ans/s00403-140323-08-15.pdf,http://www.niyamasabha.org/codes/15kla/Session_8/qns/html/s_140323(391-420).html,V K Prasanth,Communist Party Of India(Marxist),Vattiyoorkavu,കമ്മ്യൂണിസ്റ്റ് പാർട്ടി ഓഫ് ഇന്ത്യ (മാർക്സിസ്റ്റ്),വട്ടിയൂർക്കാവ്
15-8-404,15,8,404,starred,2023-03-14,starred,വില്ലേജ് ഓഫീസുകളുടെ പ്രവർത്തനം സുതാര്യമാക്കാന്‍ നടപടി,"ഡോ.കെ.ടി.ജലീൽ ശ്രീ. കെ.കെ. രാമചന്ദ്രൻ ശ്രീ. മുരളി പെരുനെല്ലി ശ്രീ. കെ.എം.സച്ചിന്‍ദേവ് : താഴെ കാണുന്ന ചോദ്യങ്ങൾക്കു റവന്യൂ-ഭവനനിര്‍മ്മാണ വകുപ്പ് മന്ത്രി സദയം മറുപടി പറയാമോ? ( എ ) സംസ്ഥാനത്ത് വില്ലേജ് ഓഫീസുകളുടെ പ്രവർത്തനം സുതാര്യവും കാര്യക്ഷമമാക്കുന്നതിനായി വില്ലേജ് തല ജനകീയ സമിതികൾ എത്രത്തോളം സഹായകരമാണ്; വിശദമാക്കാമോ; ( ബി ) ജില്ലാ, താലൂക്ക് തല വികസന സമിതികളുടെ പ്രവർത്തനം വിലയിരുത്തിയിട്ടുണ്ടോ; റവന്യൂ വകുപ്പുമായി ബന്ധപ്പെട്ട പരാതികൾ പരിഹരിക്കുന്നതിന് ഇവ എത്രത്തോളം ഫലപ്രദമാണ്; വിശദമാക്കാമോ? ഇന്ധന വില വര്‍ദ്ധനവ് മൂലം പ്രയാസം അനുഭവിക്കുന്ന ഓട്ടോറിക്ഷ, ടാക്സി ഡ്രൈവര്‍മാരെ സഹായിക്കാൻ നടപടി",,http://www.niyamasabha.org/codes/15kla/Session_8/ans/s00404-140323-08-15.pdf,http://www.niyamasabha.org/codes/15kla/Session_8/qns/html/s_140323(391-420).html,,,,,
15-8-405,15,8,405,starred,2023-03-14,starred,"ഇന്ധന വില വര്‍ദ്ധനവ് മൂലം പ്രയാസം അനുഭവിക്കുന്ന ഓട്ടോറിക്ഷ, ടാക്സി ഡ്രൈവര്‍മാരെ സഹായിക്കാൻ നടപടി","ശ്രീ.ഷാഫി പറമ്പിൽ ശ്രീ. എ.പി.അനിൽ കുമാർ | ശ്രീ പി സി വിഷ്ണുനാഥ് ശ്രീ. തിരുവഞ്ചൂർ രാധാകൃഷ്ണൻ : താഴെ കാണുന്ന ചോദ്യങ്ങൾക്കു പൊതുവിദ്യാഭ്യാസ-തൊഴിൽ വകുപ്പ് മന്ത്രി സദയം മറുപടി പറയാമോ? ( എ ) ഇന്ധന വില വര്‍ദ്ധനവ് മൂലം പ്രയാസം അനുഭവിക്കുന്ന ഓട്ടോറിക്ഷ, ടാക്സി ഡ്രൈവര്‍മാരെ സഹായിക്കുന്നതിന് ഈ സ‌‌ർക്കാ‌‌ര്‍ എന്തെങ്കിലും പദ്ധതി തയ്യാറാക്കിയിട്ടുണ്ടോ; ( ബി ) സംസ്ഥാന ബജറ്റിൽ പെട്രോളിനും ഡീസലിനും രണ്ട് രൂപ സെസ് ഏർപ്പെടുത്തിയത് ഓട്ടോറിക്ഷ, ടാക്സി ഡ്രൈവര്‍മാരെ എപ്രകാരം ബാധിക്കുമെന്ന് പരിശോധിച്ചിട്ടുണ്ടോ; വിശദമാക്കാമോ; ( സി ) ഇന്ധന വില കുതിച്ചുയരുന്ന സാഹചര്യത്തിൽ പെട്രോള്‍, ഡീസല്‍ വാഹനങ്ങള്‍ക്ക് പകരം ഇലക്ട്രിക് വാഹനങ്ങള്‍ വാങ്ങുന്നതിന് എന്തെല്ലാം സഹായങ്ങളാണ് ഓട്ടോറിക്ഷ, ടാക്സി തൊഴിലാളികൾക്കായി അനുവദിച്ചിരിക്കുന്നതെന്ന് വിശദമാക്കുമോ? വിഴിഞ്ഞം തുറമുഖ പദ്ധതി",,http://www.niyamasabha.org/codes/15kla/Session_8/ans/s00405-140323-08-15.pdf,http://www.niyamasabha.org/codes/15kla/Session_8/qns/html/s_140323(391-420).html,,,,,
15-8-406,15,8,406,starred,2023-03-14,starred,വിഴിഞ്ഞം തുറമുഖ പദ്ധതി,"ശ്രീ സി കെ ഹരീന്ദ്രന്‍ | ശ്രീ ഐ ബി സതീഷ് | ശ്രീ കെ ആൻസലൻ | ശ്രീമതി ഒ എസ് അംബിക : താഴെ കാണുന്ന ചോദ്യങ്ങൾക്കു തുറമുഖം, മ്യൂസിയം, പുരാവസ്തു, പുരാരേഖ വകുപ്പ് മന്ത്രി സദയം മറുപടി പറയാമോ? ( എ ) ഈ വർഷം സെപ്തംബറോടുകൂടി പ്രവർത്തനസജ്ജമാകുന്ന തരത്തിൽ വിഴിഞ്ഞം തുറമുഖ നിർമ്മാണം ത്വരിതഗതിയിൽ നടക്കുന്നുണ്ടോയെന്ന് വ്യക്തമാക്കുമോ; ( ബി ) വിഴിഞ്ഞം തുറമുഖത്തേക്കുള്ള റെയിൽ കണക്റ്റിവിറ്റി പ്രോജക്ടിന് കേന്ദ്ര സർക്കാരിന്റെ അംഗീകാരം ലഭിച്ചിട്ടുണ്ടോ; ( സി ) വിഴിഞ്ഞം തുറമുഖ പദ്ധതി മൂലം തൊഴിൽ നഷ്ടപ്പെടുന്നവരെ ഉപജീവന ആഘാത നിർണ്ണയ സമിതി റിപ്പോർട്ടിന്റെ അടിസ്ഥാനത്തിൽ പുനരധിവസിപ്പിക്കാനായി സ്വീകരിച്ച നടപടികൾ എന്തെല്ലാമാണെന്ന് അറിയിക്കുമോ; ( ഡി ) വിഴിഞ്ഞം തുറമുഖം നൽകാനിടയുള്ള സാമ്പത്തികാവസരങ്ങൾ വിനിയോഗിക്കുന്നതിന് ആവശ്യമായ അടിസ്ഥാന സൗകര്യങ്ങൾ ഏർപ്പെടുത്തുന്നതിനും മാനവശേഷി വികസനത്തിനും പദ്ധതിയുണ്ടോയെന്ന് വ്യക്തമാക്കുമോ? റോഡ് നിര്‍മ്മാണ രീതി നവീകരിക്കുന്നതിനുള്ള പദ്ധതി",,http://www.niyamasabha.org/codes/15kla/Session_8/ans/s00406-140323-08-15.pdf,http://www.niyamasabha.org/codes/15kla/Session_8/qns/html/s_140323(391-420).html,,,,,
15-8-407,15,8,407,starred,2023-03-14,starred,റോഡ് നിര്‍മ്മാണ രീതി നവീകരിക്കുന്നതിനുള്ള പദ്ധതി,"ശ്രീ. പി.പി. ചിത്തരഞ്ജന്‍ | ശ്രീ സി എച്ച് കുഞ്ഞമ്പു ശ്രീ. കെ.വി.സുമേഷ് ശ്രീ. പി.വി. ശ്രീനിജിൻ : താഴെ കാണുന്ന ചോദ്യങ്ങൾക്കു പൊതുമരാമത്ത്-വിനോദസഞ്ചാര വകുപ്പ് മന്ത്രി സദയം മറുപടി പറയാമോ? ( എ ) സംസ്ഥാനത്ത് പൊതുമരാമത്ത് വകുപ്പിന് കീഴിലുള്ള റോഡുകളുടെ ദൈര്‍ഘ്യം എത്രയെന്ന് സംസ്ഥാന പാത, പ്രധാന ജില്ലാപാത എന്നിവ തിരിച്ച് അറിയിക്കാമോ; ( ബി ) റോഡുകള്‍ തകരാറ് കൂടാതെ പരിപാലിക്കപ്പെടുന്നുവെന്ന് ഉറപ്പ് വരുത്തുന്നതിനായി ബാധ്യതാകാലയളവ് കഴിഞ്ഞിട്ടുള്ള റോഡുകള്‍ക്ക് റണ്ണിംഗ് കരാര്‍ നല്‍കിയിട്ടുണ്ടോ; എങ്കിൽ നിലവില്‍ ഇതുവഴി എത്ര കിലോമീറ്റര്‍ റോഡുകളുടെ കൃത്യമായ പരിപാലനം ഉറപ്പാക്കിയിട്ടുണ്ടെന്ന് വ്യക്തമാക്കുമോ; ( സി ) അതിതീവ്രമഴയേയും കാലാവസ്ഥാ വ്യതിയാനത്തേയും അതിജീവിക്കുന്ന തരത്തിൽ സംസ്ഥാനത്തെ റോഡുനിര്‍മ്മാണ രീതി നവീകരിക്കുന്നതിനായി പദ്ധതി തയ്യാറാക്കിയിട്ടുണ്ടോ; ( ഡി ) പൊതുമരാമത്ത് റോഡുകളെ സംബന്ധിച്ചുള്ള പൊതുജനങ്ങളുടെ പരാതികൾക്കുള്ള പരിഹാര സംവിധാനം കാര്യക്ഷമമായി പ്രവര്‍ത്തിക്കുന്നുണ്ടോ; അറ്റകുറ്റപ്പണികളുടെ പുരോഗതി വിലയിരുത്താന്‍ ഏര്‍പ്പെടുത്തിയിട്ടുള്ള ക്രമീകരണങ്ങൾ വിശദമാക്കാമോ? പ്രീ പ്രൈമറി വിദ്യാഭ്യാസം മെച്ചപ്പെടുത്തുന്നതിന് നടപടി",,http://www.niyamasabha.org/codes/15kla/Session_8/ans/s00407-140323-08-15.pdf,http://www.niyamasabha.org/codes/15kla/Session_8/qns/html/s_140323(391-420).html,,,,,
15-8-408,15,8,408,starred,2023-03-14,starred,പ്രീ പ്രൈമറി വിദ്യാഭ്യാസം മെച്ചപ്പെടുത്തുന്നതിന് നടപടി,"ശ്രീ. യു.എ.ലത്തീഫ് | ശ്രീ.എൻ.ഷംസുദ്ദീൻ ശ്രീ. അബ്ദുല്‍ ഹമീദ് പി | ശ്രീ എ കെ എം അഷ്റഫ് : താഴെ കാണുന്ന ചോദ്യങ്ങൾക്കു പൊതുവിദ്യാഭ്യാസ-തൊഴിൽ വകുപ്പ് മന്ത്രി സദയം മറുപടി പറയാമോ? ( എ ) സംസ്ഥാനത്ത് എല്ലാ ​​​പ്രൈമറി സ്കുളുകളി​ലും പ്രീ പ്രൈമറി ​​ക്ലാസുകൾ പ്രവർത്തിക്കുന്നുണ്ടോ; ഇല്ലെങ്കിൽ ആയത് എല്ലാ സ്കുളുകളിലും തുടങ്ങുന്നതിന് നടപടി സ്വീകരിക്കുമോ; വ്യക്തമാക്കാമോ; ( ബി ) കുട്ടികളുടെ ശാരീരിക, മാനസിക വളർച്ചക്ക് സഹായകരമായ എന്തെല്ലാം ക്രമീകരണങ്ങളാണ് പ്രസ്തുത വിദ്യാലയങ്ങളിൽ ഏർപ്പെടുത്തിയിരിക്കുന്നത്; വ്യക്തമാക്കാമോ; ( സി ) പ്രീ പ്രൈമറി വിദ്യാഭ്യാസം മെച്ചപ്പെടുത്തുന്നതിന് സ്വീകരിക്കാനുദ്ദേശിക്കുന്ന നടപടികൾ വിശദമാക്കുമോ? തീരദേശ മേഖലയിലെ വിനോദസഞ്ചാര കേന്ദ്രങ്ങളുടെ നവീകരണം",,http://www.niyamasabha.org/codes/15kla/Session_8/ans/s00408-140323-08-15.pdf,http://www.niyamasabha.org/codes/15kla/Session_8/qns/html/s_140323(391-420).html,U A Latheef,Indian Union Muslim League,Manjeri,ഇന്ത്യൻ യൂണിയൻ മുസ്ലീം ലീഗ്,മഞ്ചേരി
15-8-409,15,8,409,starred,2023-03-14,starred,തീരദേശ മേഖലയിലെ വിനോദസഞ്ചാര കേന്ദ്രങ്ങളുടെ നവീകരണം,"ശ്രീ സി എച്ച് കുഞ്ഞമ്പു | ശ്രീമതി യു പ്രതിഭ | ശ്രീ സി കെ ഹരീന്ദ്രന്‍ ശ്രീ. എം.വിജിന്‍ : താഴെ കാണുന്ന ചോദ്യങ്ങൾക്കു പൊതുമരാമത്ത്-വിനോദസഞ്ചാര വകുപ്പ് മന്ത്രി സദയം മറുപടി പറയാമോ? ( എ ) സംസ്ഥാനത്ത് ആഭ്യന്തര, വിദേശ വിനോദസഞ്ചാരികള്‍ പൊതുവെ അംഗീകരിച്ചിട്ടുള്ള വിവിധ ബീച്ചുകളുടെ നവീകരണത്തിന് നടത്തുന്ന പ്രവര്‍ത്തനങ്ങള്‍ വിലയിരുത്തിയിട്ടുണ്ടോ; വിശദമാക്കുമോ; ( ബി ) തീരദേശ മേഖലയിലെ വിനോദസഞ്ചാര കേന്ദ്രങ്ങളിലേക്ക് കൂടുതല്‍ സഞ്ചാരികളെ ആകര്‍ഷിക്കുന്നതിനായി അടിസ്ഥാനസൗകര്യ വികസനമടക്കം നടത്തിയിട്ടുള്ള പ്രവര്‍ത്തനങ്ങളുടെ ഫലമായി വിനോദസഞ്ചാരികളുടെ എണ്ണത്തില്‍ വര്‍ദ്ധനയുണ്ടായിട്ടുണ്ടോ; വിശദമാക്കുമോ; ( സി ) കോവളം ബീച്ചിന്റെ സമഗ്ര വികസനത്തിനായി പദ്ധതി തയ്യാറാക്കിയിട്ടുണ്ടോ; എങ്കിൽ വിശദാംശം നല്‍കുമോ? ദേശീയ വിദ്യാഭ്യാസ നയം",,http://www.niyamasabha.org/codes/15kla/Session_8/ans/s00409-140323-08-15.pdf,http://www.niyamasabha.org/codes/15kla/Session_8/qns/html/s_140323(391-420).html,C H Kunhambu,Communist Party Of India(Marxist),Udma,കമ്മ്യൂണിസ്റ്റ് പാർട്ടി ഓഫ് ഇന്ത്യ (മാർക്സിസ്റ്റ്),ഉദുമ
