question_id,kla,session,question_number,question_type,date,ministry,title_mal,mla_names,question_body_mal,answer_pdf_url,source_url,mla_name_eng,mla_party_eng,mla_constituency_eng,mla_party_mal,mla_constituency_mal
15-16-57,15,16,57,starred,2026-01-28,starred,ജലവൈദ്യുത പദ്ധതികൾ,ശ്രീ. എ. പ്രഭാകരൻ ശ്രീ. കെ.പി.കുഞ്ഞമ്മദ് കുട്ടി മാസ്റ്റര്‍ | ശ്രീ കെ യു ജനീഷ് കുമാർ ശ്രീ. ആന്റണി ജോൺ : താഴെ കാണുന്ന ചോദ്യങ്ങൾക്കു വൈദ്യുതി വകുപ്പ് മന്ത്രി സദയം മറുപടി പറയാമോ? ( എ ) നിലവിലെ സർക്കാരിന്റെ കാലയളവിൽ ജലവൈദ്യുത പദ്ധതികളുടെ നിര്‍മ്മാണത്തിലും പൂര്‍ത്തീകരണത്തിലും ഉണ്ടായിട്ടുള്ള പുരോഗതി വിലയിരുത്തിയിട്ടുണ്ടോ; വിശദീകരിക്കാമോ; ( ബി ) മുടങ്ങിക്കിടന്ന ഏതെല്ലാം ജലവൈദ്യുത പദ്ധതികള്‍ പൂര്‍ത്തീകരിക്കാന്‍ കഴിഞ്ഞിട്ടുണ്ട്; വ്യക്തമാക്കാമോ; ( സി ) ജലവൈദ്യുത പദ്ധതികളില്‍ നിന്നുള്ള ആകെ വൈദ്യുതി ഉല്പാദനം എത്രയാണ്; ഈ സര്‍ക്കാരിന്റെ കാലയളവില്‍ ഉല്പാദനത്തിലുണ്ടായ വര്‍ദ്ധനവ് എത്രയാണ്; വിശദാംശം നല്‍കാമോ; ( ഡി ) ഈ രംഗത്ത് നടപ്പാക്കാന്‍ തീരുമാനിച്ചിട്ടുള്ള പുതിയ പദ്ധതികള്‍ ഏതെല്ലാം; വിശദമാക്കാമോ? സംസ്ഥാനത്തെ വ്യവസായ സൗഹൃദാന്തരീക്ഷം,,http://www.niyamasabha.org/codes/15kla/Session_16/ans/s00057-280126-16-15.pdf,http://www.niyamasabha.org/codes/15kla/Session_16/qns/html/s_280126(31-60).html,,,,,
15-16-58,15,16,58,starred,2026-01-28,starred,സംസ്ഥാനത്തെ വ്യവസായ സൗഹൃദാന്തരീക്ഷം,"ശ്രീ. എ. സി. മൊയ്‌തീൻ | ശ്രീമതി ദെലീമ ശ്രീ. ലിന്റോ ജോസഫ് : താഴെ കാണുന്ന ചോദ്യങ്ങൾക്കു നിയമം, വ്യവസായം, കയർ വകുപ്പ് മന്ത്രി സദയം മറുപടി പറയാമോ? ( എ ) വ്യവസായ സൗഹൃദ അന്തരീക്ഷത്തിന്റെ കാര്യത്തിൽ രാജ്യത്ത് ഒന്നാം സ്ഥാനം കൈവരിക്കാൻ സംസ്ഥാനത്തിന് കഴിഞ്ഞിട്ടുണ്ടോ; വിശദമാക്കാമോ; ( ബി ) അന്തര്‍ദേശീയ തലത്തില്‍ ശ്രദ്ധിയാകർഷിക്കുന്ന തരത്തില്‍ സംസ്ഥാനത്തിലെ വ്യവസായ അന്തരീക്ഷത്തെ മികച്ചതാക്കി മാറ്റുന്നതിനായി സര്‍ക്കാര്‍ നടത്തിയിട്ടുള്ള ഇടപെടലുകളെക്കുറിച്ച് വിശദമാക്കാമോ; ( സി ) നിക്ഷേപ സൗഹൃദ അന്തരീക്ഷം മെച്ചപ്പെടുത്തിയത് സംസ്ഥാനത്തേക്ക് നിക്ഷേപങ്ങള്‍ എത്തിക്കുന്നതിന് സഹായകമായിട്ടുണ്ടോ; വിശദമാക്കാമോ; ( ഡി ) സംസ്ഥാനം വ്യവസായത്തിന് അനുയോജ്യമല്ലെന്ന പ്രചരണങ്ങളെ തിരുത്തിക്കൊണ്ട് സർക്കാർ നടപ്പിലാക്കിയ പരിഷ്കാരങ്ങളുടെ ഭാഗമായി മുന്നോട്ടു വച്ച സംരംഭക വർഷം, ആഗോള നിക്ഷേപക സംഗമം എന്നീ പദ്ധതികൾ വിജയകരമായി മാറ്റുവാന്‍ സാധിച്ചിട്ടുണ്ടോ; വിശദമാക്കാമോ? ചെറുകിട തുറമുഖങ്ങളുടെ വികസനം",,http://www.niyamasabha.org/codes/15kla/Session_16/ans/s00058-280126-16-15.pdf,http://www.niyamasabha.org/codes/15kla/Session_16/qns/html/s_280126(31-60).html,A C Moideen,Communist Party Of India(Marxist),Kunnamkulam,കമ്മ്യൂണിസ്റ്റ് പാർട്ടി ഓഫ് ഇന്ത്യ (മാർക്സിസ്റ്റ്),കുന്നംകുളം
15-16-59,15,16,59,starred,2026-01-28,starred,ചെറുകിട തുറമുഖങ്ങളുടെ വികസനം,ശ്രീ. എ. കെ. എം. അഷ്റഫ് ശ്രീ. കെ. പി. എ. മജീദ് ഡോ. എം. കെ. മുനീർ : താഴെ കാണുന്ന ചോദ്യങ്ങൾക്കു തുറമുഖ - സഹകരണ - ദേവസ്വം വകുപ്പ് മന്ത്രി സദയം മറുപടി പറയാമോ? ( എ ) വിഴിഞ്ഞം തുറമുഖം പൂർണ്ണസജ്ജമാകുന്നതോടെ സുഗമമായ ചരക്കു നീക്കത്തിനായി മറ്റ് ചെറുകിട-ഇടത്തരം തുറമുഖങ്ങളും വികസിപ്പിക്കപ്പെടേണ്ടതാണെന്ന് കരുതുന്നുണ്ടോ; വ്യക്തമാക്കാമോ; ( ബി ) ഇതിനായി ഏതെല്ലാം തുറമുഖങ്ങൾ വികസിപ്പിക്കുന്നതിനാണ് സർക്കാർ ഉദ്ദേശിക്കുന്നത്; ഇതിൽ സ്വകാര്യ പങ്കാളിത്തം ഉൾപ്പെടുത്തുന്നതിന് ഉദ്ദേശിക്കുന്നുണ്ടോ; എങ്കിൽ വിശദാംശം നൽകുമോ? ട്രഷറി നിയന്ത്രണം,,http://www.niyamasabha.org/codes/15kla/Session_16/ans/s00059-280126-16-15.pdf,http://www.niyamasabha.org/codes/15kla/Session_16/qns/html/s_280126(31-60).html,,,,,
15-16-60,15,16,60,starred,2026-01-28,starred,ട്രഷറി നിയന്ത്രണം,"ശ്രീ. എൽദോസ് പി. കുന്നപ്പിള്ളിൽ ശ്രീ. തിരുവഞ്ചൂർ രാധാകൃഷ്ണൻ ഡോ. മാത്യു കുഴല്‍നാടൻ ശ്രീ. ആര്യാടൻ ഷൗക്കത്ത് : താഴെ കാണുന്ന ചോദ്യങ്ങൾക്കു ധനകാര്യ വകുപ്പ് മന്ത്രി സദയം മറുപടി പറയാമോ? ( എ ) പത്തു ലക്ഷം രൂപയ്ക്ക് മുകളിലുള്ള ബില്ലുകൾ ട്രഷറിയിൽ മാറുന്നതുമായി ബന്ധപ്പെട്ട് 19/08/2025-ലെ ധനകാര്യ വകുപ്പിന്റെ ഉത്തരവ് പ്രകാരം ഏർപ്പെടുത്തിയ ട്രഷറി നിയന്ത്രണം നിലവിൽ തുടരുന്നുണ്ടോ; വ്യക്തമാക്കാമോ; ( ബി ) പ്രസ്തുത നിയന്ത്രണം നിലനിൽക്കുന്നുണ്ടെങ്കിൽ സാമ്പത്തിക വർഷം അവസാനിക്കാൻ രണ്ടര മാസം മാത്രം ശേഷിച്ചിരിക്കെ ട്രഷറി നിയന്ത്രണം ഒഴിവാക്കാൻ സർക്കാർ തയ്യാറാകുമോ; വ്യക്തമാക്കാമോ? Website maintained by Information System Section, Kerala Legislative Assembly, Thiruvananthapuram.",,http://www.niyamasabha.org/codes/15kla/Session_16/ans/s00060-280126-16-15.pdf,http://www.niyamasabha.org/codes/15kla/Session_16/qns/html/s_280126(31-60).html,,,,,
15-16-61,15,16,61,starred,2026-02-02,starred,നവകേരള നിർമ്മിതിയിൽ പട്ടികജാതി പട്ടികവർഗ്ഗ വിഭാഗത്തിന്റെ പങ്കാളിത്തം,"ശ്രീ. സി.സി. മുകുന്ദൻ | ശ്രീ വി ശശി | ശ്രീമതി സി. കെ. ആശ | ശ്രീ ജി എസ് ജയലാൽ : താഴെ കാണുന്ന ചോദ്യങ്ങൾക്കു പട്ടിക ജാതി, പട്ടിക വർഗ്ഗ, പിന്നാക്ക വിഭാഗ ക്ഷേമ വകുപ്പ് മന്ത്രി സദയം മറുപടി പറയാമോ? ( എ ) നവകേരള നിർമ്മിതിയിൽ പട്ടികജാതി-പട്ടികവർഗ്ഗ പിന്നാക്ക വിഭാഗങ്ങളുടെ സജീവ പങ്കാളിത്തം ഉറപ്പാക്കാൻ വ്യത്യസ്തങ്ങളായ കർമ്മപദ്ധതികൾ നടപ്പിലാക്കുന്നതിന് കഴിഞ്ഞിട്ടുണ്ടോ; വിശദമാക്കുമോ; ( ബി ) അത്യന്തം അപകടകരമായ ഭൂപ്രകൃതിയും കാലാവസ്ഥയുമുള്ള വനമേഖലകളിൽ അധിവസിക്കുന്ന പട്ടികവർഗ്ഗ വിഭാഗത്തിൽപ്പെട്ടവരെ അതിദാരിദ്ര്യമുക്തമാക്കുന്നതിന് ആവിഷ്കരിച്ച് നടപ്പിലാക്കിയ പദ്ധതികൾ എന്തെല്ലാമാണെന്ന് വിശദമാക്കുമോ; ( സി ) പട്ടികജാതി-പട്ടികവർഗ്ഗ വിഭാഗങ്ങളിലെ അതിദാരിദ്ര്യമുക്ത ജനവിഭാഗങ്ങളുടെ ജീവിത സാഹചര്യങ്ങൾ കൂടുതൽ മെച്ചപ്പെടുത്തുന്നതിനുവേണ്ടിയുള്ള തുടർപ്രവർത്തനങ്ങൾ എന്തെല്ലാമാണെന്ന് വിശദമാക്കുമോ; ( ഡി ) പട്ടികജാതി-പട്ടികവർഗ്ഗ വിഭാഗങ്ങളിൽപ്പെട്ട യുവാക്കൾക്ക് സർക്കാർ- സ്വകാര്യ മേഖലകളിലെ ഏറ്റവും ഉന്നത ശ്രേണിയിലുള്ള തൊഴിലുകളിൽ പ്രവൃത്തി പരിചയവും പരിശീലനവും ലഭ്യമാക്കുന്നതിന് നടപ്പിലാക്കുന്ന പദ്ധതികൾ എന്തെല്ലാമാണെന്ന് വിശദമാക്കുമോ? ആദിവാസി വിദ്യാര്‍ത്ഥികളുടെ പഠനം കാര്യക്ഷമമാക്കുന്നതിന് നടപടി",,http://www.niyamasabha.org/codes/15kla/Session_16/ans/s00061-020226-16-15.pdf,http://www.niyamasabha.org/codes/15kla/Session_16/qns/html/s_020226(61-90).html,C C Mukundan,Communist Party Of India,Nattika (SC),കമ്മ്യൂണിസ്റ്റ് പാർട്ടി ഓഫ് ഇന്ത്യ,നാട്ടിക (SC)
15-16-62,15,16,62,starred,2026-02-02,starred,ആദിവാസി വിദ്യാര്‍ത്ഥികളുടെ പഠനം കാര്യക്ഷമമാക്കുന്നതിന് നടപടി,"ശ്രീ. കെ.കെ. രാമചന്ദ്രൻ ശ്രീ. കെ. ബാബു (നെന്മാറ) ശ്രീ. പി. ടി. എ. റഹീം | ശ്രീ ജി സ്റ്റീഫന്‍ : താഴെ കാണുന്ന ചോദ്യങ്ങൾക്കു പട്ടിക ജാതി, പട്ടിക വർഗ്ഗ, പിന്നാക്ക വിഭാഗ ക്ഷേമ വകുപ്പ് മന്ത്രി സദയം മറുപടി പറയാമോ? ( എ ) സംസ്ഥാനത്തെ ആദിവാസി സമൂഹത്തില്‍പ്പെട്ട വിദ്യാര്‍ത്ഥികളുടെ പഠനം കാര്യക്ഷമമാക്കുന്നതിനായി നിലവില്‍ എന്തെല്ലാം പദ്ധതികളാണ് നടപ്പിലാക്കി വരുന്നതെന്ന് അറിയിക്കാമോ; ( ബി ) ഏതെല്ലാം കോഴ്സുകൾക്കാണ് ഇത്തരത്തിൽ പഠനത്തിനായി ധനസഹായം നൽകുന്നത്; ഏതെല്ലാം പദ്ധതികളിലൂടെയാണ് ഈ സഹായം ലഭ്യമാകുന്നത്; വ്യക്തമാക്കാമോ; ( സി ) ആദിവാസി കുടിലുകളില്‍ താമസിക്കുന്ന കുട്ടികള്‍ക്ക് അവരുടെ തനത് ഭാഷയില്‍ പ്രാഥമിക വിദ്യാഭ്യാസം നല്‍കണമെന്ന ആവശ്യം ഉയര്‍ന്നു വന്നിട്ടുണ്ടോ; വിശദമാക്കാമോ; ( ഡി ) കഴിഞ്ഞ പത്തു വർഷത്തിനിടയിൽ ഏതെല്ലാം സ്കൂളുകളിലൂടെയാണ് ഈ വിദ്യാർത്ഥികളെ അവരുടെ തനത് ഭാഷയിൽ പഠിപ്പിക്കാൻ സാധിച്ചിട്ടുള്ളത്? ജലനയം",,http://www.niyamasabha.org/codes/15kla/Session_16/ans/s00062-020226-16-15.pdf,http://www.niyamasabha.org/codes/15kla/Session_16/qns/html/s_020226(61-90).html,,,,,
15-16-63,15,16,63,starred,2026-02-02,starred,ജലനയം,ശ്രീ. ടി. വി. ഇബ്രാഹിം ശ്രീ. എൻ. ഷംസുദ്ദീൻ ശ്രീ. മഞ്ഞളാംകുഴി അലി ശ്രീ. പി. അബ്ദുല്‍ ഹമീദ് : താഴെ കാണുന്ന ചോദ്യങ്ങൾക്കു ജലവിഭവ വകുപ്പ് മന്ത്രി സദയം മറുപടി പറയാമോ? ( എ ) സംസ്ഥാനത്ത് കിണറുകൾ കുഴിക്കുന്നതിനും ഭൂഗർഭ ജലത്തിന്റെ ഉപയോഗത്തിനും നിയന്ത്രണങ്ങൾ ഏർപ്പെടുത്തുവാൻ ഉദ്ദേശിക്കുന്നുണ്ടോ; വ്യക്തമാക്കാമോ; ( ബി ) അശാസ്ത്രീയമായ രീതിയിലുളള കിണർ നിർമ്മാണം തടയുന്നതിന് എന്തെല്ലാം നടപടികൾ സ്വീകരിക്കാനാണ് ഉദ്ദേശിക്കുന്നതെന്ന് വ്യക്തമാക്കാമോ; ( സി ) വരൾച്ചയും ജലക്ഷാമവും ഉളള പ്രദേശങ്ങളിലെ അമിത ജല ഉപയോഗത്തിന് നിയന്ത്രണം ഏർപ്പെടുത്താൻ ഉദ്ദേശിക്കുന്നുണ്ടോ; വിശദമാക്കാമോ; ( ഡി ) സംസ്ഥാനത്ത് ജലനയം രൂപീകരിച്ചിട്ടുണ്ടോ; എങ്കിൽ വിശദാംശം നൽകുമോ? വന്യജീവി ആക്രമണ പ്രതിരോധ നടപടി,,http://www.niyamasabha.org/codes/15kla/Session_16/ans/s00063-020226-16-15.pdf,http://www.niyamasabha.org/codes/15kla/Session_16/qns/html/s_020226(61-90).html,,,,,
15-16-64,15,16,64,starred,2026-02-02,starred,വന്യജീവി ആക്രമണ പ്രതിരോധ നടപടി,ശ്രീ.കെ .ഡി .പ്രസേനൻ ശ്രീ. എ. സി. മൊയ്‌തീൻ | ശ്രീ ഡി കെ മുരളി | ശ്രീ എം രാജഗോപാലൻ : താഴെ കാണുന്ന ചോദ്യങ്ങൾക്കു വനം-വന്യജീവി വകുപ്പ് മന്ത്രി സദയം മറുപടി പറയാമോ? ( എ ) വന്യജീവി ആക്രമണ പ്രതിരോധത്തിനായി ഏതൊക്കെ മിഷനുകൾ രൂപീകരിച്ചിട്ടുണ്ട്; ഈ മിഷനുകളുടെ പ്രവ‍ർത്തനം വിലയിരുത്തിയിട്ടുണ്ടോ; വിശദമാക്കാമോ; ( ബി ) സംസ്ഥാനത്ത് എത്ര ഹെക്ടർ ഏകവിളതോട്ടങ്ങൾ സ്വാഭാവിക വനങ്ങളാക്കി മാറ്റിയിട്ടുണ്ട്; വ്യക്തമാക്കാമോ; ( സി ) കാവുകളുടെ സംരക്ഷണത്തിനും നവീകരണത്തിനുമായി 2016 മുതൽ 2025 വരെ എത്ര തുക ധനസഹായമായി നൽകിയിട്ടുണ്ട്; വ്യക്തമാക്കാമോ; ( ഡി ) സംസ്ഥാന വനം വകുപ്പിന്റെ പ്രവർത്തനങ്ങൾക്ക് ഏതൊക്കെ അവാർഡുകൾ 2016 മുതൽ 2025 വരെ ലഭിച്ചിട്ടുണ്ടെന്ന് വിശദമാക്കാമോ? കിഫ്ബി മുഖേന മത്സ്യമാര്‍ക്കറ്റുകളുടെ നവീകരണം,,http://www.niyamasabha.org/codes/15kla/Session_16/ans/s00064-020226-16-15.pdf,http://www.niyamasabha.org/codes/15kla/Session_16/qns/html/s_020226(61-90).html,,,,,
15-16-65,15,16,65,starred,2026-02-02,starred,കിഫ്ബി മുഖേന മത്സ്യമാര്‍ക്കറ്റുകളുടെ നവീകരണം,"ശ്രീ വി ജോയി ശ്രീ. തോട്ടത്തില്‍ രവീന്ദ്രന്‍ | ശ്രീ എം മുകേഷ് ശ്രീ. എൻ. കെ. അക്ബര്‍ : താഴെ കാണുന്ന ചോദ്യങ്ങൾക്കു മത്സ്യബന്ധനം, സാംസ്കാരികം, യുവജനകാര്യ വകുപ്പ് മന്ത്രി സദയം മറുപടി പറയാമോ? ( എ ) സംസ്ഥാനത്തെ മത്സ്യമാര്‍ക്കറ്റുകളുടെ അടിസ്ഥാന സൗകര്യ വികസനത്തിനും ആധുനികവല്‍ക്കരണത്തിനും ആവിഷ്കരിച്ചിട്ടുള്ള പദ്ധതികളുടെ വിശദാംശം ലഭ്യമാക്കാമോ; ( ബി ) കിഫ്ബി ധനസഹായത്തോടെ സംസ്ഥാനത്തൊട്ടാകെ എത്ര മത്സ്യമാര്‍ക്കറ്റുകളുടെ നവീകരണം നടപ്പിലാക്കിയിട്ടുണ്ട്; ( സി ) മത്സ്യമാര്‍ക്കറ്റുകളുടെ നവീകരണത്തിന് കിഫ്ബി വഴി 2021-25 വരെ ഏതൊക്കെ പദ്ധതികള്‍ക്ക് തത്വത്തില്‍ അംഗീകാരം ലഭിച്ചിട്ടുണ്ടെന്നും ഇതില്‍ ഏതൊക്കെ പദ്ധതികള്‍ക്ക് നിര്‍മ്മാണ അനുമതി ലഭിച്ചിട്ടുണ്ടെന്നും വ്യക്തമാക്കാമോ? കുടിവെള്ള പദ്ധതികൾ സമയബന്ധിതമായി പൂർത്തീകരിക്കാൻ നടപടി",,http://www.niyamasabha.org/codes/15kla/Session_16/ans/s00065-020226-16-15.pdf,http://www.niyamasabha.org/codes/15kla/Session_16/qns/html/s_020226(61-90).html,,,,,
15-16-66,15,16,66,starred,2026-02-02,starred,കുടിവെള്ള പദ്ധതികൾ സമയബന്ധിതമായി പൂർത്തീകരിക്കാൻ നടപടി,ശ്രീ. കെ.പി.മോഹനന്‍ | ശ്രീ തോമസ് കെ തോമസ് | ശ്രീ കോവൂർ കുഞ്ഞുമോൻ | ശ്രീ മാത്യു ടി. തോമസ് : താഴെ കാണുന്ന ചോദ്യങ്ങൾക്കു ജലവിഭവ വകുപ്പ് മന്ത്രി സദയം മറുപടി പറയാമോ? ( എ ) സംസ്ഥാനത്തെ കുടിവെള്ള പദ്ധതികൾ സമയബന്ധിതമായി പൂർത്തീകരിക്കാൻ സ്വീകരിച്ചു വരുന്ന നടപടികൾ വിശദമാക്കാമോ; ( ബി ) കുടിവെള്ള പദ്ധതികൾ അനിശ്ചിതമായി നീട്ടികൊണ്ടുപോകുന്നതു മൂലം നിർമ്മാണ ചെലവ് വലിയ തോതിൽ വർദ്ധിക്കുന്നത് തടയാൻ നടപടി സ്വീകരിക്കുമോ; വിശദമാക്കാമോ? സേഫ് പദ്ധതി,,http://www.niyamasabha.org/codes/15kla/Session_16/ans/s00066-020226-16-15.pdf,http://www.niyamasabha.org/codes/15kla/Session_16/qns/html/s_020226(61-90).html,,,,,
15-16-67,15,16,67,starred,2026-02-02,starred,സേഫ് പദ്ധതി,"ഡോ. സുജിത് വിജയൻപിള്ള ശ്രീ. ഐ. ബി. സതീഷ് ശ്രീ. സേവ്യര്‍ ചിറ്റിലപ്പിള്ളി ശ്രീ. എ. പ്രഭാകരൻ : താഴെ കാണുന്ന ചോദ്യങ്ങൾക്കു പട്ടിക ജാതി, പട്ടിക വർഗ്ഗ, പിന്നാക്ക വിഭാഗ ക്ഷേമ വകുപ്പ് മന്ത്രി സദയം മറുപടി പറയാമോ? ( എ ) പട്ടികജാതി-പട്ടികവര്‍ഗ്ഗ കുടുംബങ്ങളുടെ അപൂര്‍ണ്ണവും പൂര്‍ത്തീകരിക്കാത്തതുമായ ഭവനങ്ങളുടെ പൂര്‍ത്തീകരണത്തിനും നവീകരണത്തിനുമായി ആരംഭിച്ച സേഫ് പദ്ധതിയുടെ നിലവിലുള്ള പ്രവര്‍ത്തനം വിശദമാക്കാമോ; ( ബി ) അപൂര്‍ണ്ണമായ വീടുകളുടെ പൂര്‍ത്തീകരണത്തിനും നവീകരണത്തിനുമായി സേഫ് പദ്ധതി വഴി എത്ര തുക നല്‍കി വരുന്നു; വ്യക്തമാക്കാമോ; ( സി ) 2021 മുതൽ 2025 വരെയുള്ള കാലയളവിൽ സേഫ് പദ്ധതി വഴി എത്ര പട്ടികജാതി-പട്ടികവര്‍ഗ്ഗ കുടുംബങ്ങള്‍ ഗുണഭോക്താക്കള്‍ ആയിട്ടുണ്ട്; വിശദമാക്കാമോ? പട്ടികജാതി-പട്ടികവര്‍ഗ്ഗ വിഭാഗങ്ങളുടെ ക്ഷേമത്തിനായുള്ള പദ്ധതികൾ",,http://www.niyamasabha.org/codes/15kla/Session_16/ans/s00067-020226-16-15.pdf,http://www.niyamasabha.org/codes/15kla/Session_16/qns/html/s_020226(61-90).html,,,,,
