question_id,kla,session,question_number,question_type,date,ministry,title_mal,mla_names,question_body_mal,answer_pdf_url,source_url,mla_name_eng,mla_party_eng,mla_constituency_eng,mla_party_mal,mla_constituency_mal
15-16-176,15,16,176,starred,2026-02-05,starred,ആശുപത്രി കെട്ടിടങ്ങളുടെ ബലക്ഷയം,ശ്രീ. പി. കെ. ബഷീർ ശ്രീ. കെ. പി. എ. മജീദ് ഡോ. എം. കെ. മുനീർ : താഴെ കാണുന്ന ചോദ്യങ്ങൾക്കു ആരോഗ്യ- വനിത-ശിശുവികസന വകുപ്പ് മന്ത്രി സദയം മറുപടി പറയാമോ? ( എ ) പ്രാഥമിക ആരോഗ്യ കേന്ദ്രങ്ങൾ മുതൽ ജില്ലാ ജനറൽ ആശുപ​ത്രി വരെയുള്ള ബലക്ഷയമുളള കെട്ടിടങ്ങളുടെ കണക്ക് ശേഖരിച്ചിട്ടുണ്ടോ; വിശദാംശം നൽകുമോ; ( ബി ) അത്തരം കെട്ടിടങ്ങൾ ഉപയോഗിക്കുന്നില്ലെന്ന് ഉറപ്പു വരുത്താൻ വേണ്ട നടപടി സ്വീകരിച്ചിട്ടുണ്ടോ; വിശദമാക്കാമോ; ( സി ) ബലക്ഷയമുളള കെട്ടിടങ്ങൾക്കു പകരം പുതിയ ​കെട്ടിടങ്ങൾ നിർമ്മിക്കുന്നതിന് എന്തെങ്കിലും പദ്ധതി ആവിഷ്ക്കരിക്കാൻ ഉദ്ദേശിക്കുന്നുണ്ടോ എന്ന് വ്യക്തമാക്കുമോ? വിമുക്തി പദ്ധതി,,http://www.niyamasabha.org/codes/15kla/Session_16/ans/s00176-050226-16-15.pdf,http://www.niyamasabha.org/codes/15kla/Session_16/qns/html/s_050226(151-180).html,,,,,
15-16-177,15,16,177,starred,2026-02-05,starred,വിമുക്തി പദ്ധതി,"ശ്രീ തോമസ് കെ തോമസ് | ശ്രീ കോവൂർ കുഞ്ഞുമോൻ | ശ്രീ മാത്യു ടി. തോമസ് ശ്രീ. കെ.പി.മോഹനന്‍ : താഴെ കാണുന്ന ചോദ്യങ്ങൾക്കു തദ്ദേശ സ്വയംഭരണ - എക്സൈസ്‌ - പാര്‍ലമെന്ററികാര്യ വകുപ്പ് മന്ത്രി സദയം മറുപടി പറയാമോ? ( എ ) കേരളത്തിലെ യുവാക്കളില്‍ മയക്കുമരുന്ന് ഉപയോഗം വർദ്ധിക്കുന്നത് തടയാൻ കൂടുതൽ നടപടികൾ സ്വീകരിക്കുമോ; എങ്കിൽ വിശദാംശം ലഭ്യമാക്കുമോ; ( ബി ) വിമുക്തി പദ്ധതി വ്യാപകമാക്കുന്നതിനും സ്‌കൂൾ, കോളേജ് തലങ്ങളിൽ നിർബന്ധിത ബോധവൽക്കരണം നടപ്പാക്കുന്നതിനും എന്തൊക്കെ പുതിയ നടപടികൾ സ്വീകരിക്കുമെന്ന് വ്യക്തമാക്കുമോ? തദ്ദേശസ്വയംഭരണ റോഡുകളുടെ ജി.ഐ.എസ്. അധിഷ്ഠിത വിവരശേഖരണം",,http://www.niyamasabha.org/codes/15kla/Session_16/ans/s00177-050226-16-15.pdf,http://www.niyamasabha.org/codes/15kla/Session_16/qns/html/s_050226(151-180).html,Thomas K Thomas,Nationalist Congress Party,Kuttanad,നാഷണലിസ്റ്റ് കോൺഗ്രസ് പാർട്ടി,കുട്ടനാട്
15-16-178,15,16,178,starred,2026-02-05,starred,തദ്ദേശസ്വയംഭരണ റോഡുകളുടെ ജി.ഐ.എസ്. അധിഷ്ഠിത വിവരശേഖരണം,"ശ്രീ. കെ.വി.സുമേഷ് ഡോ. കെ. ടി. ജലീൽ ശ്രീ. ആന്റണി ജോൺ | ശ്രീ വി ജോയി : താഴെ കാണുന്ന ചോദ്യങ്ങൾക്കു തദ്ദേശ സ്വയംഭരണ - എക്സൈസ്‌ - പാര്‍ലമെന്ററികാര്യ വകുപ്പ് മന്ത്രി സദയം മറുപടി പറയാമോ? ( എ ) രാജ്യത്താദ്യമായി തദ്ദേശസ്വയംഭരണ റോഡുകളുടെ ജി.ഐ.എസ്. അധിഷ്ഠിത വിവരശേഖരണം സമയബന്ധിതമായി പൂര്‍ത്തീകരിക്കുന്നതിന് എന്തെല്ലാം നടപടികളാണ് സ്വീകരിച്ചതെന്ന് വ്യക്തമാക്കാമോ; ( ബി ) ഇതിനായി എന്തെല്ലാം സാങ്കേതിക സൗകര്യങ്ങളാണ് പ്രയോജനപ്പെടുത്തിയതെന്ന് വെളിപ്പെടുത്താമോ; ( സി ) തദ്ദേശസ്വയംഭരണ സ്ഥാപനങ്ങളിലെ റോഡുകളുടെ ആസ്തി വിവരങ്ങള്‍ ശേഖരിച്ചതില്‍ മുനിസിപ്പല്‍ കോര്‍പ്പറേഷന്‍, മുനിസിപ്പാലിറ്റികള്‍, ജില്ലാപഞ്ചായത്തുകള്‍, ഗ്രാമപഞ്ചായത്തുകള്‍ എന്നിവകളുടെ അധീനതയില്‍ ഓരോന്നും എത്ര കിലോമീറ്റര്‍ വീതമെന്ന് പ്രത്യേകം വിവരങ്ങള്‍ ലഭ്യമാക്കുമോ? ലഹരി ഉപയോഗം",,http://www.niyamasabha.org/codes/15kla/Session_16/ans/s00178-050226-16-15.pdf,http://www.niyamasabha.org/codes/15kla/Session_16/qns/html/s_050226(151-180).html,,,,,
15-16-179,15,16,179,starred,2026-02-05,starred,ലഹരി ഉപയോഗം,"ശ്രീ. പി. ബാലചന്ദ്രൻ ശ്രീ. ഇ കെ വിജയൻ | ശ്രീ ജി എസ് ജയലാൽ ശ്രീ. ഇ. ടി. ടൈസൺ മാസ്റ്റർ : താഴെ കാണുന്ന ചോദ്യങ്ങൾക്കു തദ്ദേശ സ്വയംഭരണ - എക്സൈസ്‌ - പാര്‍ലമെന്ററികാര്യ വകുപ്പ് മന്ത്രി സദയം മറുപടി പറയാമോ? ( എ ) ലഹരി വ്യാപനം തടയുന്നതിന് പോലീസ്, എക്സൈസ്, ബന്ധപ്പെട്ട മറ്റ് വകുപ്പുകള്‍, സന്നദ്ധ സംഘടനകൾ, പൊതുജനങ്ങൾ എന്നിവരുടെ കൂട്ടായ പ്രവര്‍ത്തനങ്ങള്‍ നിര്‍ണ്ണായകമാണ് എന്നത് ശ്രദ്ധയിൽപ്പെട്ടിട്ടുണ്ടോ; വിശദമാക്കാമോ; ( ബി ) മയക്കുമരുന്ന് വിതരണവും ഉപയോഗവും പൂർണമായി തടഞ്ഞ് സംസ്ഥാനത്തെ ലഹരിമുക്തമാക്കുന്നതിനുള്ള സമഗ്രപദ്ധതിക്ക് സർക്കാർ രൂപം നൽകിയിട്ടുണ്ടോ; വിശദമാക്കാമോ; ( സി ) ലഹരിയില്‍ നിന്നും സാധാരണ ജീവിതത്തിലേക്ക് മടങ്ങി വരുന്നവരെ ഉൾക്കൊള്ളുന്ന തരത്തിൽ സമൂഹത്തെ മാറ്റിയെടുക്കുന്നതിനും അവർ വീണ്ടും ലഹരിയിലേക്ക് തിരിയാതിരിക്കാനുമുള്ള ജാഗ്രത പുലര്‍ത്തുന്നതിനും നടപടികൾ സ്വീകരിച്ചിട്ടുണ്ടോ; വിശദമാക്കാമോ; ( ഡി ) ലഹരിക്കടത്തിന് കുട്ടികളെ ഉൾപ്പെടെ ദുരുപയോഗം ചെയ്യുന്നതായി ശ്രദ്ധയില്‍പ്പെട്ടിട്ടുണ്ടോ; ഇക്കാര്യത്തില്‍ എന്തൊക്കെ പ്രതിരോധ നടപടികളാണ് എക്സൈസ് വകുപ്പ് സ്വീകരിച്ചിട്ടുള്ളത്; വിശദമാക്കാമോ? പയ്യന്നൂർ ഫണ്ട് വിവാദം",,http://www.niyamasabha.org/codes/15kla/Session_16/ans/s00179-050226-16-15.pdf,http://www.niyamasabha.org/codes/15kla/Session_16/qns/html/s_050226(151-180).html,,,,,
15-16-180,15,16,180,starred,2026-02-05,starred,പയ്യന്നൂർ ഫണ്ട് വിവാദം,"ശ്രീ. സണ്ണി ജോസഫ് ശ്രീ. എൽദോസ് പി. കുന്നപ്പിള്ളിൽ ഡോ. മാത്യു കുഴല്‍നാടൻ ശ്രീ. ടി. ജെ. വിനോദ് : താഴെ കാണുന്ന ചോദ്യങ്ങൾക്കു മുഖ്യമന്ത്രി സദയം മറുപടി പറയാമോ? ( എ ) നിലവിലെ പയ്യന്നൂർ എം.എൽ.എ. ഏരിയ സെക്രട്ടറി ആയിരിക്കെ ധനരാജ് രക്തസാക്ഷി ഫണ്ട്, ഏരിയ കമ്മിറ്റി ഓഫീസ് നിർമാണ ഫണ്ട്, തിരഞ്ഞെടുപ്പ് ഫണ്ട് എന്നിവയിൽ തിരിമറി നടത്തിയെന്ന സി. പി. ഐ. എം കണ്ണൂർ ജില്ലാ കമ്മിറ്റി അംഗവും മുൻ പയ്യന്നൂർ ഏരിയ സെക്രട്ടറിയുമായിരുന്ന വ്യക്തിയുടെ വെളിപ്പെടുത്തൽ ശ്രദ്ധയിൽപ്പെട്ടിട്ടുണ്ടോ; ( ബി ) പ്രസ്തുത വെളിപ്പെടുത്തലിന്റെ അടിസ്ഥാനത്തിൽ പോലീസ് കേസ് രജിസ്റ്റർ ചെയ്തിട്ടുണ്ടോ; ഇല്ലെങ്കിൽ കാരണം വിശദമാക്കാമോ; ( സി ) പ്രസ്തുത വെളിപ്പെടുത്തലിൽ സർക്കാർ സ്വീകരിച്ച നടപടികൾ വിശദമാക്കാമോ? Website maintained by Information System Section, Kerala Legislative Assembly, Thiruvananthapuram.",,http://www.niyamasabha.org/codes/15kla/Session_16/ans/s00180-050226-16-15.pdf,http://www.niyamasabha.org/codes/15kla/Session_16/qns/html/s_050226(151-180).html,,,,,
15-16-181,15,16,181,starred,2026-02-23,starred,നീതി ആയോഗ് തയ്യാറാക്കിയ കയറ്റുമതി സൂചിക,"ശ്രീ. അനൂപ് ജേക്കബ്‌ ശ്രീ. മോൻസ് ജോസഫ് ശ്രീ. പി. ജെ. ജോസഫ് ശ്രീ. മാണി. സി. കാപ്പൻ : താഴെ കാണുന്ന ചോദ്യങ്ങൾക്കു ധനകാര്യ വകുപ്പ് മന്ത്രി സദയം മറുപടി പറയാമോ? ( എ ) നീതി ആയോഗ് തയ്യാറാക്കിയ ഏറ്റവും പുതിയ സൂചികയിൽ കേരളം മുൻവർഷത്തേക്കാൾ നില മെച്ചപ്പെടുത്തി 11-ാം സ്ഥാനത്തെത്തിയതായി റിപ്പോർട്ട് ചെയ്യപ്പെട്ടിട്ടുള്ളതിനാലും എന്നാൽ ഈ വർഷം റാങ്കിംഗ് നിർണ്ണയിക്കുന്നതിന് ഉപയോഗിച്ച രീതി മുൻവർഷങ്ങളിൽ നിന്ന് വ്യത്യസ്തമാണെന്നതിനാലും ഈ റാങ്ക് മെച്ചപ്പെടുത്തൽ സംസ്ഥാനത്തിന്റെ യഥാർത്ഥ പുരോഗതിയെയാണോ സൂചിപ്പിക്കുന്നതെന്നത് വിലയിരുത്തിയിട്ടുണ്ടോ; ( ബി ) കയറ്റുമതി വൈവിധ്യവത്കരണം, മാനവവിഭവ ശേഷി, വ്യവസായ അടിസ്ഥാന സൗകര്യങ്ങൾ തുടങ്ങിയ മാനദണ്ഡങ്ങളിലാണ് നീതി ആയോഗ് ഈ സൂചിക തയ്യാറാക്കിയിരിക്കുന്നതെന്നതിനാല്‍ ഈ മേഖലകളിൽ കേരളത്തിന്റെ പ്രകടനം മെച്ചപ്പെടുത്തുന്നതിനായി സ്വീകരിച്ചിട്ടുള്ള നയപരവും പദ്ധതിപരവുമായ നടപടികൾ എന്തൊക്കെയാണ്; ( സി ) വ്യവസായങ്ങൾക്ക് ആവശ്യമായ ഭൂമിയുടെ കുറവ്, ഉയർന്ന ഉൽപാദനച്ചെലവ്, വൻകിട വ്യവസായങ്ങളുടെ അഭാവം, യുവാക്കളുടെ വിദേശ കുടിയേറ്റം, ജനസംഖ്യയിലെ പ്രായമേറുന്നവരുടെ എണ്ണം, റിസർച്ച് & ഡവലപ്മെന്റിനുള്ള പരിമിതമായ ഊന്നൽ എന്നിവ കേരളത്തിന്റെ പ്രധാന വെല്ലുവിളികളായി നിതി ആയോഗ് റിപ്പോർട്ടില്‍ ചൂണ്ടിക്കാണിച്ചിട്ടുണ്ടോ; ഉണ്ടെങ്കിൽ ഇവ മറികടക്കാൻ തയ്യാറാക്കിയ ദീർഘകാല പ്രവർത്തന പദ്ധതി എന്താണ്; ( ഡി ) നീതി ആയോഗ് സംസ്ഥാനങ്ങളെ ലീഡർ, ചാലഞ്ചർ, ആസ്പയറർ എന്നിങ്ങനെ മൂന്ന് വിഭാഗങ്ങളായി തരംതിരിച്ചതിൽ കേരളം ചാലഞ്ചർ വിഭാഗത്തിലാണ് ഉൾപ്പെട്ടിരിക്കുന്നതെന്നതിനാല്‍ ലീഡർ വിഭാഗത്തിലേക്ക് ഉയരുന്നതിനായി കേന്ദ്ര സർക്കാരുമായി സഹകരിച്ച് സംസ്ഥാന സർക്കാർ സ്വീകരിക്കാൻ ഉദ്ദേശിക്കുന്ന പ്രത്യേക നടപടികൾ എന്തൊക്കെയാണ്? ആഗോള അയ്യപ്പ സംഗമം",,http://www.niyamasabha.org/codes/15kla/Session_16/ans/s00181-230226-16-15.pdf,http://www.niyamasabha.org/codes/15kla/Session_16/qns/html/s_230226(181-210).html,,,,,
15-16-182,15,16,182,starred,2026-02-23,starred,ആഗോള അയ്യപ്പ സംഗമം,ശ്രീ. റോജി എം. ജോൺ ശ്രീ. ഐ. സി. ബാലകൃഷ്ണൻ ശ്രീ. സജീവ് ജോസഫ് | ശ്രീമതി ഉമ തോമസ് : താഴെ കാണുന്ന ചോദ്യങ്ങൾക്കു തുറമുഖ - സഹകരണ - ദേവസ്വം വകുപ്പ് മന്ത്രി സദയം മറുപടി പറയാമോ? ( എ ) ആഗോള അയ്യപ്പ സംഗമത്തിനായി ശബരിമല ജനറൽ ഫണ്ടിൽ നിന്നും എടുത്ത 2 കോടി രൂപ തിരിച്ചടച്ചിട്ടില്ല എന്ന സ്പെഷ്യൽ കമ്മീഷണർ റിപ്പോർട്ടിലെ പരാമർശം ഗൗരവത്തോടെ കാണുന്നുണ്ടോ; ( ബി ) ആഗോള അയ്യപ്പ സംഗമവുമായി ബന്ധപ്പെട്ട പരിപാടികളിൽ കൃത്യമായ ജി.എസ്.ടി. ബില്ലുകൾ സമർപ്പിച്ചിട്ടില്ല എന്ന കാര്യം ശ്രദ്ധയിൽപ്പെട്ടിട്ടുണ്ടോ; ( സി ) കൃത്യമായ ജി.എസ്.ടി. ബില്ലുകൾ സമർപ്പിക്കാത്തതു മൂലം ദേവസ്വം ബോർഡിന് ലക്ഷങ്ങളുടെ ഇന്‍പുട്ട് ടാക്സ് ക്രെഡിറ്റ് ലഭ്യമാക്കാൻ സാധിച്ചിട്ടില്ല എന്ന കാര്യം ഗൗരവത്തോടെ കാണുന്നുണ്ടോ; വ്യക്തമാക്കുമോ? ജി.എസ്.ടി. ബേസിൽ വർദ്ധനവ്,,http://www.niyamasabha.org/codes/15kla/Session_16/ans/s00182-230226-16-15.pdf,http://www.niyamasabha.org/codes/15kla/Session_16/qns/html/s_230226(181-210).html,,,,,
15-16-183,15,16,183,starred,2026-02-23,starred,ജി.എസ്.ടി. ബേസിൽ വർദ്ധനവ്,ശ്രീ. അൻവർ സാദത്ത് ശ്രീ. എ. പി. അനിൽ കുമാർ ശ്രീ. തിരുവഞ്ചൂർ രാധാകൃഷ്ണൻ ശ്രീ. എം. വിൻസെന്റ് : താഴെ കാണുന്ന ചോദ്യങ്ങൾക്കു ധനകാര്യ വകുപ്പ് മന്ത്രി സദയം മറുപടി പറയാമോ? ( എ ) ജി.എസ്.ടി. നടപ്പിലാക്കിയ ശേഷം ജി.എസ്.ടി. ബേസിൽ കാര്യമായ വർദ്ധനവ് ഉണ്ടാക്കാൻ സാധിച്ചിട്ടില്ലായെന്ന കാര്യം ശ്രദ്ധയില്‍പ്പെട്ടിട്ടുണ്ടോ; വിശദമാക്കാമോ; ( ബി ) നൂതന സാങ്കേതിക വിദ്യ ഉപയോഗപ്പെടുത്തി വ്യാപാരികളുടെ വിവിധ തരം സാമ്പത്തിക ഡാറ്റ വിശകലനം ചെയ്തു കൊണ്ട് സംസ്ഥാനത്തെ ജി.എസ്.ടി. ബേസിൽ വർദ്ധനവ് വരുത്താൻ ഇടപെടൽ നടത്തുമോ; വിശദമാക്കാമോ? ഊര്‍ജ്ജ കാര്യക്ഷമത,,http://www.niyamasabha.org/codes/15kla/Session_16/ans/s00183-230226-16-15.pdf,http://www.niyamasabha.org/codes/15kla/Session_16/qns/html/s_230226(181-210).html,,,,,
15-16-184,15,16,184,starred,2026-02-23,starred,ഊര്‍ജ്ജ കാര്യക്ഷമത,ശ്രീ കെ യു ജനീഷ് കുമാർ | ശ്രീ കടകംപള്ളി സുരേന്ദ്രന്‍ ശ്രീ. പി.പി. സുമോദ് ശ്രീ. യു. ആര്‍. പ്രദീപ് : താഴെ കാണുന്ന ചോദ്യങ്ങൾക്കു വൈദ്യുതി വകുപ്പ് മന്ത്രി സദയം മറുപടി പറയാമോ? ( എ ) രാജ്യത്തെ ഊര്‍ജ്ജ കാര്യക്ഷമത സൂചിക പ്രകാരം ഈ സര്‍ക്കാർ എന്തെല്ലാം നേട്ടങ്ങള്‍ കൈവരിച്ചിട്ടുണ്ട്; വിശദമാക്കാമോ; ( ബി ) സംസ്ഥാനത്തെ ഊര്‍ജ്ജ മേഖലയിലെ പ്രവര്‍ത്തനങ്ങള്‍ക്ക് ദേശീയ അംഗീകാരം ലഭിച്ചിട്ടുണ്ടോ; നീതി ആയോഗിന്റെ സ്റ്റേറ്റ് എനര്‍ജി & ക്ലൈമറ്റ് ഇന്‍ഡക്സ് റിപ്പോര്‍ട്ട് പ്രകാരം സംസ്ഥാനത്തിന്റെ സ്ഥാനം എത്രയാണ്; വ്യക്തമാക്കുമോ; ( സി ) സംസ്ഥാനത്തെ ഊര്‍ജ്ജ രംഗത്തെ പുത്തന്‍ പ്രവണതകള്‍ സംബന്ധിച്ച് ചര്‍ച്ച ചെയ്യുന്നതിനും ഊര്‍ജ്ജ കാര്യക്ഷമത സംബന്ധിച്ച് പൊതുജനങ്ങളില്‍ അവബോധം സൃഷ്ടിക്കുന്നതിനുമായി ഊര്‍ജ്ജ മേളകള്‍ സംഘടിപ്പിക്കുവാന്‍ കഴിഞ്ഞിട്ടുണ്ടോ; വിശദമാക്കുമോ; ( ഡി ) ഈ വര്‍ഷം സംഘടിപ്പിച്ച ഊര്‍ജ്ജമേള സംബന്ധിച്ച് അവലോകനം നടത്തിയിട്ടുണ്ടോ; വിശദാംശം നല്‍കുമോ? നികുതിചോർച്ച ഒഴിവാക്കാന്‍ നടപടി,,http://www.niyamasabha.org/codes/15kla/Session_16/ans/s00184-230226-16-15.pdf,http://www.niyamasabha.org/codes/15kla/Session_16/qns/html/s_230226(181-210).html,,,,,
15-16-185,15,16,185,starred,2026-02-23,starred,നികുതിചോർച്ച ഒഴിവാക്കാന്‍ നടപടി,"പ്രൊഫ. ആബിദ് ഹുസൈൻ തങ്ങൾ ശ്രീ. എൻ. ഷംസുദ്ദീൻ ശ്രീ. എൻ. എ. നെല്ലിക്കുന്ന് ശ്രീ. പി. ഉബൈദുള്ള : താഴെ കാണുന്ന ചോദ്യങ്ങൾക്കു ധനകാര്യ വകുപ്പ് മന്ത്രി സദയം മറുപടി പറയാമോ? ( എ ) സംസ്ഥാനത്ത് വ്യാജ ജി.എസ്.ടി. രജിസ്ട്രേഷൻ ഉപയോഗിച്ച് നികുതി വെട്ടിപ്പുകൾ നടത്തിയിട്ടുള്ളതായി കണ്ടെത്തിയിട്ടുണ്ടോ; ( ബി ) ഇത്തരം തട്ടിപ്പുകൾ കണ്ടെത്തുന്നതിനായി ജി.എസ്.ടി. ഇന്റലിജൻസ്, എൻഫോഴ്സ്മെന്റ് വിഭാഗങ്ങൾ പരിശോധനകൾ നടത്താറുണ്ടോ; എങ്കിൽ അടുത്തകാലത്തായി നടത്തിയ പരിശോധനകളിൽ കണ്ടെത്തിയ ക്രമക്കേടുകളുടെ വിശദാംശം വ്യക്തമാക്കാമോ; ( സി ) നികുതിചോർച്ച ഒഴിവാക്കുന്നതിനായി സ്വീകരിക്കാനുദ്ദേശിക്കുന്ന നടപടികളെന്തൊക്കെയാണെന്ന് വിശദമാക്കാമോ? ദേശീയ വൈദ്യുതി നയം",,http://www.niyamasabha.org/codes/15kla/Session_16/ans/s00185-230226-16-15.pdf,http://www.niyamasabha.org/codes/15kla/Session_16/qns/html/s_230226(181-210).html,,,,,
