question_id,kla,session,question_number,question_type,date,ministry,title_mal,mla_names,question_body_mal,answer_pdf_url,source_url,mla_name_eng,mla_party_eng,mla_constituency_eng,mla_party_mal,mla_constituency_mal
15-8-222,15,8,222,starred,2023-02-28,starred,അട്ടപ്പാടി മേഖലയിലെ ശിശുമരണം ആവർത്തിക്കാതിരിക്കാന്‍ നടപടി,"ശ്രീ. എ . പി . അനിൽ കുമാർ ശ്രീമതി.ഉമ തോമസ് ഡോ. മാത്യു കുഴല്‍നാടൻ ശ്രീ. റോജി എം. ജോൺ : താഴെ കാണുന്ന ചോദ്യങ്ങൾക്കു പട്ടികജാതി, പട്ടികവര്‍ഗ്ഗ, പിന്നാക്ക വിഭാഗക്ഷേമവും ദേവസ്വവും പാര്‍ലമെന്ററികാര്യവും വകുപ്പ് മന്ത്രി സദയം മറുപടി പറയാമോ? ( എ ) അട്ടപ്പാടി മേഖലയിൽ ശിശുമരണങ്ങൾ ആവർത്തിക്കുന്നതായി ശ്രദ്ധയില്‍പ്പെട്ടിട്ടുണ്ടോ; എങ്കില്‍ ഇത്‍ സർക്കാർ ഗൗരവത്തോടെ കാണുന്നുണ്ടോ; ( ബി ) 2023 ജനുവരി മാസത്തിൽ പുതൂർ പഞ്ചായത്തിലെ ചാളയൂർ ഊരിൽ ഉമപ്രിയ, അപ്പു ദമ്പതികളുടെ കുഞ്ഞ് മരിച്ച സംഭവം ശ്രദ്ധയിൽപ്പെട്ടിട്ടുണ്ടോ; ( സി ) സമാനമായ സംഭവങ്ങൾ ആവർത്തിക്കാതിരിക്കാനായി ഗർഭിണികൾക്കും കുട്ടികൾക്കും മതിയായ ചികിത്സയും പോഷകാഹാരവും ലഭ്യമാക്കാനും ആയത് ഉറപ്പുവരുത്തുവാനും വകുപ്പ് കൈക്കൊണ്ട നടപടികൾ എന്തെല്ലാമാണെന്ന് വിശദമാക്കുമോ? കുടിവെള്ള പദ്ധതികള്‍ സമയബന്ധിതമായി പൂര്‍ത്തീകരിക്കാന്‍ നടപടി",,http://www.niyamasabha.org/codes/15kla/Session_8/ans/s00222-280223-08-15.pdf,http://www.niyamasabha.org/codes/15kla/Session_8/qns/html/s_280223(211-240).html,,,,,
15-8-223,15,8,223,starred,2023-02-28,starred,കുടിവെള്ള പദ്ധതികള്‍ സമയബന്ധിതമായി പൂര്‍ത്തീകരിക്കാന്‍ നടപടി,"ശ്രീ കെ ബി ഗണേഷ് കുമാർ | ശ്രീ തോമസ് കെ തോമസ് | ശ്രീ കോവൂർ കുഞ്ഞുമോൻ ശ്രീ. കെ.പി.മോഹനന്‍ : താഴെ കാണുന്ന ചോദ്യങ്ങൾക്കു ജലവിഭവ വകുപ്പ് മന്ത്രി സദയം മറുപടി പറയാമോ? ( എ ) സംസ്ഥാനത്ത് കുടിവെള്ള പദ്ധതികള്‍ സമയബന്ധിതമായി പൂര്‍ത്തീകരിക്കാന്‍ സ്വീകരിച്ചുവരുന്ന നടപടികള്‍ എന്തെല്ലാമെന്ന് വ്യക്തമാക്കുമോ; ( ബി ) മുടങ്ങിക്കിടക്കുന്ന കുടിവെള്ള പദ്ധതികള്‍ എല്‍.ഐ.സി., ജെ.ഐ.സി.എ. തുടങ്ങിയ ഏജൻസികളുടെ സഹായത്തോടെ പൂര്‍ത്തീകരിക്കാന്‍ സ്വീകരിച്ചുവരുന്ന നടപടികള്‍ എന്തെല്ലാമെന്ന് വ്യക്തമാക്കുമോ? പ്രാദേശിക മത്സ്യകൃഷി വ്യാപിപ്പിക്കാന്‍ നടപടി",,http://www.niyamasabha.org/codes/15kla/Session_8/ans/s00223-280223-08-15.pdf,http://www.niyamasabha.org/codes/15kla/Session_8/qns/html/s_280223(211-240).html,K B Ganesh Kumar,Kerala Congress (B),Pathanapuram,കേരള കോൺഗ്രസ് (ബി),പത്തനാപുരം
15-8-224,15,8,224,starred,2023-02-28,starred,പ്രാദേശിക മത്സ്യകൃഷി വ്യാപിപ്പിക്കാന്‍ നടപടി,"ശ്രീ. സെബാസ്റ്റ്യൻ കുളത്തുങ്കല്‍ ശ്രീ. ജോബ് മൈക്കിള്‍ | ശ്രീ പ്രമോദ് നാരായൺ ഡോ. എൻ. ജയരാജ് : താഴെ കാണുന്ന ചോദ്യങ്ങൾക്കു മത്സ്യബന്ധനം, സാംസ്കാരികം, യുവജനകാര്യ വകുപ്പ് മന്ത്രി സദയം മറുപടി പറയാമോ? ( എ ) സംസ്ഥാനത്ത് പ്രാദേശിക മത്സ്യകൃഷി പ്രോത്സാഹിപ്പിക്കാന്‍ സ്വീകരിച്ചിട്ടുള്ള നടപടികള്‍ വിശദമാക്കാമോ; ( ബി ) തദ്ദേശീയ മത്സ്യകര്‍ഷകര്‍ക്ക് മത്സ്യക്കുഞ്ഞുങ്ങളെ വിതരണം ചെയ്തുവരുന്നുണ്ടോ; എങ്കിൽ ഏതൊക്കെയിനം മത്സ്യക്കുഞ്ഞുങ്ങളെയാണ് വിതരണം ചെയ്യുന്നതെന്ന് അറിയിക്കാമോ; ( സി ) അപ്രകാരം വിതരണം ചെയ്യുന്ന മത്സ്യക്കുഞ്ഞുങ്ങളില്‍ ചിലയിനത്തിന് രുചി കുറവാണെന്നതിനാല്‍ അത്തരം മത്സ്യങ്ങള്‍ക്ക് വിപണി ലഭിക്കുന്നില്ല എന്നത് ശ്രദ്ധയില്‍പ്പെട്ടിട്ടുണ്ടോ; ( ഡി ) പൊതുസ്വീകാര്യമായതും രുചികരമായതുമായ ഇനത്തില്‍പ്പെട്ട മത്സ്യക്കുഞ്ഞുങ്ങളെ വിതരണം ചെയ്യുന്നതിന് നടപടി സ്വീകരിക്കുമോ; ( ഇ ) പ്രാദേശികമായി ഉല്പാദിപ്പിക്കുന്ന മത്സ്യങ്ങള്‍ക്ക് വേണ്ടത്ര വിപണി ലഭിക്കാത്തതിനാല്‍ ഫിഷറീസ് വകുപ്പിന്റെ തന്നെ ആഭിമുഖ്യത്തില്‍ സംസ്ഥാന തലത്തില്‍ വിപണി വ്യാപിപ്പിക്കുന്നതിന് നടപടി സ്വീകരിക്കുമോ? കേരള അർബൻ വാട്ടർ സർവീസസ് ഇംപ്രൂവ്‌മെന്റ് പ്രോജക്ട്",,http://www.niyamasabha.org/codes/15kla/Session_8/ans/s00224-280223-08-15.pdf,http://www.niyamasabha.org/codes/15kla/Session_8/qns/html/s_280223(211-240).html,,,,,
15-8-225,15,8,225,starred,2023-02-28,starred,കേരള അർബൻ വാട്ടർ സർവീസസ് ഇംപ്രൂവ്‌മെന്റ് പ്രോജക്ട്,"ശ്രീ. എൽദോസ് പി. കുന്നപ്പിള്ളിൽ | ശ്രീ പി സി വിഷ്ണുനാഥ് ശ്രീ. അൻവർ സാദത്ത് | ശ്രീ എം വിൻസെൻറ് : താഴെ കാണുന്ന ചോദ്യങ്ങൾക്കു ജലവിഭവ വകുപ്പ് മന്ത്രി സദയം മറുപടി പറയാമോ? ( എ ) കേരള അർബൻ വാട്ടർ സർവീസസ് ഇംപ്രൂവ്‌മെന്റ് പ്രോജക്ടിന്റെ വിശദാംശം ലഭ്യമാക്കുമോ; ( ബി ) തിരുവനന്തപുരം, എറണാകുളം ജില്ലകളിലെ കുടിവെള്ള വിതരണവും വെള്ളക്കരം പിരിക്കാനുള്ള ചുമതലയും സ്വകാര്യകമ്പനിക്ക് കൈമാറാൻ പ്രസ്തുത പദ്ധതിയുടെ ഭാഗമായി ധാരണയായിട്ടുണ്ടോ; വ്യക്തമാക്കുമോ; ( സി ) എങ്കിൽ പ്രസ്തുത കരാറിലെ പ്രധാനപ്പെട്ട വ്യവസ്ഥകൾ എന്തൊക്കെയാണെന്ന് വിശദമാക്കുമോ? വന്യജീവി ആക്രമണത്തിന് ഇരയാകുന്ന പട്ടിക വിഭാഗക്കാര്‍ക്കുളള ഇൻഷുറൻസ് പദ്ധതി",,http://www.niyamasabha.org/codes/15kla/Session_8/ans/s00225-280223-08-15.pdf,http://www.niyamasabha.org/codes/15kla/Session_8/qns/html/s_280223(211-240).html,,,,,
15-8-226,15,8,226,starred,2023-02-28,starred,വന്യജീവി ആക്രമണത്തിന് ഇരയാകുന്ന പട്ടിക വിഭാഗക്കാര്‍ക്കുളള ഇൻഷുറൻസ് പദ്ധതി,"ഡോ. എം.കെ.മുനീർ | ശ്രീ .പി. കെ. ബഷീർ | ശ്രീ.എൻ.ഷംസുദ്ദീൻ | ശ്രീ എ കെ എം അഷ്റഫ് : താഴെ കാണുന്ന ചോദ്യങ്ങൾക്കു വനം-വന്യജീവി വകുപ്പ് മന്ത്രി സദയം മറുപടി പറയാമോ? ( എ ) വനത്തിനുളളിലും വനാതിർത്തിയിലും താമസിച്ചുവരുന്ന, വന്യജീവി ആക്രമണത്തിന് ഇരയാകുന്ന പട്ടികജാതി, പട്ടികവർഗ്ഗ വിഭാഗത്തിൽപ്പെട്ടവർക്ക് വനം വകുപ്പ് ഏർപ്പെടുത്തിയിരുന്ന ഇൻഷുറൻസ് പദ്ധതി നിർത്തലാക്കിയിട്ടുണ്ടോ; ( ബി ) പ്രസ്തുത പദ്ധതി മുഖേന ലഭിച്ചിരുന്ന ആനുകൂല്യങ്ങൾ എന്തെല്ലാമാണെന്ന് വ്യക്തമാക്കുമോ; ( സി ) വന്യജീവി ആക്രമണം വർദ്ധിച്ചുവരുന്ന ഈ കാലത്ത് മുൻകാല പ്രാബല്യത്തോടെ പ്രസ്തുത പദ്ധതി പുന:സ്ഥാപിക്കാൻ നടപടി സ്വീകരിക്കുമോ; വിശദാംശം അറിയിക്കുമോ? ബി.പി.എല്‍. വിഭാഗത്തില്‍പ്പെട്ടവര്‍ക്ക് കുടിവെള്ള കണക്ഷന്‍",,http://www.niyamasabha.org/codes/15kla/Session_8/ans/s00226-280223-08-15.pdf,http://www.niyamasabha.org/codes/15kla/Session_8/qns/html/s_280223(211-240).html,Dr. M K Muneer,Indian Union Muslim League,Koduvally,ഇന്ത്യൻ യൂണിയൻ മുസ്ലീം ലീഗ്,കൊടുവള്ളി
15-8-227,15,8,227,starred,2023-02-28,starred,ബി.പി.എല്‍. വിഭാഗത്തില്‍പ്പെട്ടവര്‍ക്ക് കുടിവെള്ള കണക്ഷന്‍,ശ്രീ. തോട്ടത്തില്‍ രവീന്ദ്രന്‍ | ശ്രീ കടകംപള്ളി സുരേന്ദ്രന്‍ ശ്രീ. കെ. ജെ. മാക്‌സി ശ്രീ. പി. മമ്മിക്കുട്ടി : താഴെ കാണുന്ന ചോദ്യങ്ങൾക്കു ജലവിഭവ വകുപ്പ് മന്ത്രി സദയം മറുപടി പറയാമോ? ( എ ) സംസ്ഥാനത്ത് അര്‍ഹതപ്പെട്ട ബി.പി.എല്‍. വിഭാഗക്കാര്‍ക്ക് സൗജന്യമായി കുടിവെള്ള കണക്ഷന്‍ നല്‍കുന്നുണ്ടോ; എങ്കിൽ കൂടുതല്‍ ബി.പി.എല്‍. കുടുംബങ്ങള്‍ക്ക് കുടിവെള്ള കണക്ഷന്‍ നല്‍കുന്നതിന് പദ്ധതിയുണ്ടോ; വിശദാംശം ലഭ്യമാക്കാമോ; ( ബി ) അര്‍ഹരായവർക്ക് കുടിവെള്ള കണക്ഷന്‍ ബി.പി.എല്‍. വിഭാഗത്തിലേക്ക് മാറ്റാനായി അപേക്ഷ നല്‍കുന്നതിന് അവസരം നല്‍കിയിട്ടുണ്ടോ; വിശദമാക്കുമോ? പട്ടികഗോത്ര വര്‍ഗ്ഗ വിഭാഗത്തിൽപ്പെട്ടവര്‍ക്ക് ഭൂമി ലഭ്യമാക്കുന്ന പദ്ധതി,,http://www.niyamasabha.org/codes/15kla/Session_8/ans/s00227-280223-08-15.pdf,http://www.niyamasabha.org/codes/15kla/Session_8/qns/html/s_280223(211-240).html,,,,,
15-8-228,15,8,228,starred,2023-02-28,starred,പട്ടികഗോത്ര വര്‍ഗ്ഗ വിഭാഗത്തിൽപ്പെട്ടവര്‍ക്ക് ഭൂമി ലഭ്യമാക്കുന്ന പദ്ധതി,"ശ്രീമതി കെ. കെ. ശൈലജ ടീച്ചർ ശ്രീ. കെ.കെ. രാമചന്ദ്രൻ | ശ്രീ ജി സ്റ്റീഫന്‍ ശ്രീ. ലിന്റോ ജോസഫ് : താഴെ കാണുന്ന ചോദ്യങ്ങൾക്കു പട്ടികജാതി, പട്ടികവര്‍ഗ്ഗ, പിന്നാക്ക വിഭാഗക്ഷേമവും ദേവസ്വവും പാര്‍ലമെന്ററികാര്യവും വകുപ്പ് മന്ത്രി സദയം മറുപടി പറയാമോ? ( എ ) ഈ സര്‍ക്കാര്‍ അധികാരത്തില്‍ വന്നതിനുശേഷം പട്ടികഗോത്ര വര്‍ഗ്ഗ വിഭാഗത്തിൽപ്പെട്ടവര്‍ക്ക് വനാവകാശനിയമം, ലാന്‍ഡ് ബാങ്ക്, നിക്ഷിപ്‌ത വനഭൂമി എന്നിവയില്‍ ഉള്‍പ്പെടുത്തി ഭൂമി ലഭ്യമാക്കിയിട്ടുണ്ടോ; വിശദാംശം നൽകുമോ; ( ബി ) പട്ടികഗോത്ര വര്‍ഗ്ഗ വിഭാഗത്തിൽപ്പെട്ടവര്‍ക്ക് ഭൂമി ലഭ്യമാക്കുന്നതുമായി ബന്ധപ്പെട്ട് പ്രത്യേക മിഷന് രൂപം കൊടുത്തിട്ടുണ്ടോ; എങ്കിൽ ഇതിന്റെ പ്രവര്‍ത്തനം വിശദമാക്കാമോ? പട്ടികജാതി, പട്ടികഗോത്ര വര്‍ഗ്ഗ വിഭാഗത്തിൽപ്പെട്ട യുവജനങ്ങളുടെ തൊഴില്‍ പങ്കാളിത്തം",,http://www.niyamasabha.org/codes/15kla/Session_8/ans/s00228-280223-08-15.pdf,http://www.niyamasabha.org/codes/15kla/Session_8/qns/html/s_280223(211-240).html,,,,,
15-8-229,15,8,229,starred,2023-02-28,starred,"പട്ടികജാതി, പട്ടികഗോത്ര വര്‍ഗ്ഗ വിഭാഗത്തിൽപ്പെട്ട യുവജനങ്ങളുടെ തൊഴില്‍ പങ്കാളിത്തം","ശ്രീ. കെ.എം.സച്ചിന്‍ദേവ് | ശ്രീ ഒ . ആർ. കേളു ശ്രീ. കെ. പ്രേംകുമാര്‍ ശ്രീ. എ. രാജ : താഴെ കാണുന്ന ചോദ്യങ്ങൾക്കു പട്ടികജാതി, പട്ടികവര്‍ഗ്ഗ, പിന്നാക്ക വിഭാഗക്ഷേമവും ദേവസ്വവും പാര്‍ലമെന്ററികാര്യവും വകുപ്പ് മന്ത്രി സദയം മറുപടി പറയാമോ? ( എ ) സംസ്ഥാനത്ത് പട്ടികജാതി, പട്ടികഗോത്ര വര്‍ഗ്ഗ വിഭാഗത്തിൽപ്പെട്ട യുവജനങ്ങളുടെ തൊഴില്‍ പങ്കാളിത്തം വര്‍ദ്ധിപ്പിക്കുന്നതിനായി മാനവവിഭവശേഷി വികസനത്തിനുള്ള എന്തൊക്കെ പരിപാടികളാണ് നടപ്പിലാക്കിയിട്ടുള്ളത്; അവയുടെ ഫലപ്രാപ്തി അവലോകനം ചെയ്തിട്ടുണ്ടോ; വിശദമാക്കാമോ; ( ബി ) പ്രസ്തുത വിഭാഗങ്ങളില്‍പ്പെട്ട യുവജനങ്ങള്‍ക്ക് സംരംഭകത്വ പരിശീലനം നല്‍കുന്നതിനും സംരംഭങ്ങള്‍ ആരംഭിക്കാന്‍ വേണ്ട മൂലധന വായ്പ ലഭ്യമാക്കുന്നതിനുമുള്ള പദ്ധതി കാര്യക്ഷമമായി നടക്കുന്നുവെന്ന് ഉറപ്പ് വരുത്താന്‍ കഴിഞ്ഞിട്ടുണ്ടോ; എങ്കിൽ ഇത്തരം പദ്ധതികളില്‍ വനിതകളുടെ പങ്കാളിത്തം ഉറപ്പാക്കാന്‍ കഴിഞ്ഞിട്ടുണ്ടോ; ( സി ) പട്ടികഗോത്ര വര്‍ഗ്ഗ വിഭാഗങ്ങളില്‍പ്പെട്ട യുവതികളില്‍ താെഴില്‍, വ്യാപാര മേഖലകളിൽ നെെപുണ്യം വളര്‍ത്തുന്നതിന് വനിതാ വികസന കോർപ്പറേഷന്റെ ആഭിമുഖ്യത്തില്‍ സംയോജിത വനിതാ നെെപുണ്യ വികസന കേന്ദ്രങ്ങള്‍ ആരംഭിക്കാന്‍ ഉദ്ദേശിക്കുന്നുണ്ടോ; എങ്കിൽ വിശദമാക്കാമോ? യുവജന കമ്മീഷന്റെ ഉദ്ദേശ്യലക്ഷ്യങ്ങൾ",,http://www.niyamasabha.org/codes/15kla/Session_8/ans/s00229-280223-08-15.pdf,http://www.niyamasabha.org/codes/15kla/Session_8/qns/html/s_280223(211-240).html,,,,,
15-8-230,15,8,230,starred,2023-02-28,starred,യുവജന കമ്മീഷന്റെ ഉദ്ദേശ്യലക്ഷ്യങ്ങൾ,"ശ്രീ. നജീബ് കാന്തപുരം | ശ്രീ.പി.ഉബൈദുള്ള ശ്രീ. അബ്ദുല്‍ ഹമീദ് പി | ശ്രീ . ടി. വി. ഇബ്രാഹിം : താഴെ കാണുന്ന ചോദ്യങ്ങൾക്കു മത്സ്യബന്ധനം, സാംസ്കാരികം, യുവജനകാര്യ വകുപ്പ് മന്ത്രി സദയം മറുപടി പറയാമോ? ( എ ) കേരള സംസ്ഥാന യുവജന കമ്മീഷന്റെ ഉദ്ദേശ്യലക്ഷ്യങ്ങൾ എന്തെല്ലാമാണ്; വിശദമാക്കുമോ; ( ബി ) പ്രസ്തുത ഉദ്ദേശ്യലക്ഷ്യങ്ങൾ കൈവരിക്കുന്നതിന് കമ്മീഷന് കഴിയുന്നുണ്ടോ എന്ന് പരിശോധിച്ചിട്ടുണ്ടോ; വ്യക്തമാക്കുമോ; ( സി ) കമ്മീഷന്റെ പ്രവർത്തനം മെച്ചപ്പെടുത്തുന്നതിനും യുവജന പങ്കാളിത്തം ഉറപ്പാക്കുന്നതിനും സ്വീകരിക്കാൻ ഉദ്ദേശിക്കുന്ന നടപടികൾ വിശദമാക്കുമോ? പട്ടികജാതി യുവാക്കൾക്ക് സുസ്ഥിര വരുമാനം",,http://www.niyamasabha.org/codes/15kla/Session_8/ans/s00230-280223-08-15.pdf,http://www.niyamasabha.org/codes/15kla/Session_8/qns/html/s_280223(211-240).html,Najeeb Kanthapuram,Indian Union Muslim League,Perinthalmanna,ഇന്ത്യൻ യൂണിയൻ മുസ്ലീം ലീഗ്,പെരിന്തൽമണ്ണ
15-8-231,15,8,231,starred,2023-02-28,starred,പട്ടികജാതി യുവാക്കൾക്ക് സുസ്ഥിര വരുമാനം,"ശ്രീ എ കെ എം അഷ്റഫ് ശ്രീ. കുറുക്കോളി മൊയ്തീൻ | ശ്രീ . മഞ്ഞളാംകുഴി അലി : താഴെ കാണുന്ന ചോദ്യങ്ങൾക്കു പട്ടികജാതി, പട്ടികവര്‍ഗ്ഗ, പിന്നാക്ക വിഭാഗക്ഷേമവും ദേവസ്വവും പാര്‍ലമെന്ററികാര്യവും വകുപ്പ് മന്ത്രി സദയം മറുപടി പറയാമോ? ( എ ) സംസ്ഥാനത്ത് പട്ടികജാതി യുവാക്കൾക്ക് വിദേശത്ത് ഉൾപ്പെ​ടെ തൊഴിൽ മേഖല കണ്ടെത്തി സുസ്ഥിര വരുമാനം സാധ്യമാക്കുന്നതിന് പദ്ധതി ആവിഷ്കരിച്ചിട്ടുണ്ടോയെന്ന് വ്യക്തമാക്കുമോ; ( ബി ) എങ്കിൽ പ്രസ്തുത പദ്ധതിയിൽ ഏതെല്ലാം തൊഴിൽ മേഖലകളെയാണ് ഉൾപ്പെടുത്തിയിരിക്കുന്നതെന്ന് അറിയിക്കാമോ; ( സി ) പ്രസ്തുത പദ്ധതിയുടെ ഗുണം ലഭിക്കുന്നതിനായി എല്ലാ ജില്ലകളിലും പരിശീലന കേന്ദ്രങ്ങൾ ആരംഭിക്കുന്ന കാര്യം പരിഗണിക്കുമോ എന്ന് വ്യക്തമാക്കാമോ? പട്ടികജാതി, പട്ടികഗോത്ര വര്‍ഗ്ഗ സമൂഹങ്ങളുടെ ശാക്തീകരണം",,http://www.niyamasabha.org/codes/15kla/Session_8/ans/s00231-280223-08-15.pdf,http://www.niyamasabha.org/codes/15kla/Session_8/qns/html/s_280223(211-240).html,,,,,
