question_id,kla,session,question_number,question_type,date,ministry,title_mal,mla_names,question_body_mal,answer_pdf_url,source_url,mla_name_eng,mla_party_eng,mla_constituency_eng,mla_party_mal,mla_constituency_mal
15-8-468,15,8,468,starred,2023-03-16,starred,വടക്കാഞ്ചേരിയിൽ ലൈഫ് മിഷന്റെ ഭാഗമായി യൂണിടാക്ക് കമ്പനിക്ക് നിർമ്മാണ കരാർ,"ശ്രീ സി ആര്‍ മഹേഷ് ശ്രീമതി.ഉമ തോമസ് : താഴെ കാണുന്ന ചോദ്യങ്ങൾക്കു തദ്ദേശ സ്വയംഭരണം, എക്സൈസ്‌ വകുപ്പ് മന്ത്രി സദയം മറുപടി പറയാമോ? ( എ ) വടക്കാഞ്ചേരിയിൽ ലൈഫ് മിഷന്റെ ഭാഗമായി റെഡ്ക്രെസന്റ് എന്ന വിദേശ സ്ഥാപനത്തിൽ നിന്നും സഹായം ലഭ്യമാക്കികൊണ്ട് നിർമ്മിക്കുന്ന ഫ്ലാറ്റിന്റെ നിർമ്മാണ കരാർ യൂണിടാക്ക് കമ്പനിക്ക് നൽകാനായി തീരുമാനമെടുത്തിരുന്നോ; വിശദമാക്കാമോ; ( ബി ) പ്രസ്തുത ഭവന സമുച്ചയത്തിന്റെ പ്ലാൻ യൂണിടാക്ക് എന്ന സ്ഥാപനം ലൈഫ് മിഷന് സമർപ്പിച്ചിരുന്നോ എന്നും പ്ലാനിന് ലൈഫ് മിഷൻ അംഗീകാരം നൽകിയിരുന്നോ എന്നും പ്ലാൻ സ്പെസിഫിക്കേഷൻ അനുസരിച്ചാണെന്ന് ഉറപ്പാക്കിയിരുന്നോ എന്നും വിശദമാക്കുമോ? ഉപഭോക്തൃ സംരക്ഷണം ഉറപ്പാക്കാൻ നടപടി",,http://www.niyamasabha.org/codes/15kla/Session_8/ans/s00468-160323-08-15.pdf,http://www.niyamasabha.org/codes/15kla/Session_8/qns/html/s_160323(451-480).html,,,,,
15-8-469,15,8,469,starred,2023-03-16,starred,ഉപഭോക്തൃ സംരക്ഷണം ഉറപ്പാക്കാൻ നടപടി,ശ്രീ പി എസ്‍ സുപാല്‍ | ശ്രീമതി സി. കെ. ആശ | ശ്രീ വി ശശി ശ്രീ. വാഴൂര്‍ സോമൻ : താഴെ കാണുന്ന ചോദ്യങ്ങൾക്കു ഭക്ഷ്യ-പൊതുവിതരണ വകുപ്പ് മന്ത്രി സദയം മറുപടി പറയാമോ? ( എ ) സംസ്ഥാനത്ത് ഉപഭോക്തൃ സേവനങ്ങൾ സാധാരണ ജനങ്ങളിലേയ്ക്ക് അനായാസം എത്തിക്കുന്നതിനും ഉപഭോക്തൃ സംരക്ഷണം ഉറപ്പാക്കുന്നതിനുമായി ലീഗൽ മെട്രോളജി വകുപ്പിൽ പരിഷ്‌കാരങ്ങള്‍ നടപ്പാക്കിയിട്ടുണ്ടോ; വിശദമാക്കാമോ; ( ബി ) ആയതിന്റെ ഭാഗമായി വകുപ്പ് നടത്തിയ പരിശോധനകളില്‍ നിയമ ലംഘനങ്ങൾ കണ്ടെത്തിയിട്ടുണ്ടോ; എങ്കിൽ ഇക്കാര്യത്തില്‍ സ്വീകരിച്ച തുടർനടപടികൾ അറിയിക്കുമോ; ( സി ) കോവിഡ് വ്യാപനത്തിന്റെ ഫലമായി വ്യാപാരികൾ നേരിട്ട നിയമപരമായ പ്രയാസങ്ങൾ പരിഹരിക്കുവാൻ വകുപ്പ് നടപടി കൈക്കൊണ്ടിട്ടുണ്ടോ; എങ്കിൽ വിശദാംശം അറിയിക്കുമോ; ( ഡി ) കോവിഡ് മൂലവും മറ്റ് കാരണങ്ങളാലും മുദ്രവെയ്പ്പ് കുടിശിക ആയ അളവ് തൂക്ക ഉപകരണങ്ങൾ മുദ്ര വെയ്ക്കുന്നതിനായി പിഴ ഇളവ് ചെയ്ത് നൽകുന്നത് സംബന്ധിച്ച് നടപടികൾ കൈക്കൊണ്ടിട്ടുണ്ടോ; എങ്കിൽ വിശദാംശം അറിയിക്കുമോ; ( ഇ ) ലീഗൽ മെട്രോളജി വകുപ്പിനെ കടലാസ് രഹിത ഓഫീസാക്കി മാറ്റുക എന്ന ഉദ്ദേശ്യത്തോടെ ആധുനികവത്കരണ പ്രവർത്തനങ്ങള്‍ ആരംഭിച്ചിട്ടുണ്ടോ; വിശദമാക്കാമോ? മെഡിക്കല്‍ കോളേജുകളെ സെന്റര്‍ ഓഫ് എക്സലന്‍സ് ആയി ഉയര്‍ത്താന്‍ നടപടി,,http://www.niyamasabha.org/codes/15kla/Session_8/ans/s00469-160323-08-15.pdf,http://www.niyamasabha.org/codes/15kla/Session_8/qns/html/s_160323(451-480).html,,,,,
15-8-470,15,8,470,starred,2023-03-16,starred,മെഡിക്കല്‍ കോളേജുകളെ സെന്റര്‍ ഓഫ് എക്സലന്‍സ് ആയി ഉയര്‍ത്താന്‍ നടപടി,"ശ്രീ. ടി.ഐ.മധുസൂദനന്‍ ശ്രീ. കെ. ബാബു (നെന്മാറ) | ശ്രീ ജി സ്റ്റീഫന്‍ ശ്രീ. കെ.എൻ. ഉണ്ണിക്കൃഷ്ണൻ : താഴെ കാണുന്ന ചോദ്യങ്ങൾക്കു ആരോഗ്യ- വനിത-ശിശുവികസന വകുപ്പ് മന്ത്രി സദയം മറുപടി പറയാമോ? ( എ ) എല്ലാ രണ്ടാം വര്‍ഷ പി.ജി. ഡോക്ടര്‍മാരെയും ജില്ലാ ജനറല്‍ ആശുപത്രികളിലും താലൂക്ക് ആശുപത്രികളിലും പഠന സേവനത്തിന്റെ ഭാഗമായി നിയമിക്കാന്‍ തീരുമാനിച്ചിട്ടുണ്ടോ; വ്യക്തമാക്കുമോ; ( ബി ) ദ്വിതീയ തലത്തിലുള്ള ആരോഗ്യ സംവിധാനം ശാക്തീകരിച്ച് മെഡിക്കല്‍ കോളേജുകളെ റെഫറൽ ആശുപത്രികളാക്കി സെന്റര്‍ ഓഫ് എക്സലന്‍സ് ആയി ഉയര്‍ത്തുന്നതിന് പദ്ധതിയുണ്ടോ; വിശദമാക്കുമോ; ( സി ) റീജണല്‍ കാന്‍സര്‍ സെന്റര്‍, മലബാര്‍ കാന്‍സര്‍ സെന്റര്‍ എന്നീ സ്ഥാപനങ്ങളിൽ റോബോട്ടിക് ശസ്ത്രക്രിയ ഉള്‍പ്പെടെയുള്ള സൗകര്യങ്ങള്‍ ഏര്‍പ്പെടുത്തി ഉത്കൃഷ്ട ചികിത്സാ കേന്ദ്രങ്ങള്‍ ആയി വികസിപ്പിക്കുന്നതിനായി പദ്ധതി ആവിഷ്കരിച്ചിട്ടുണ്ടോയെന്ന് വ്യക്തമാക്കുമോ? തദ്ദേശ സ്വയംഭരണ സ്ഥാപനങ്ങളില്‍ ഓഡിറ്റ് കമ്മീഷൻ",,http://www.niyamasabha.org/codes/15kla/Session_8/ans/s00470-160323-08-15.pdf,http://www.niyamasabha.org/codes/15kla/Session_8/qns/html/s_160323(451-480).html,,,,,
15-8-471,15,8,471,starred,2023-03-16,starred,തദ്ദേശ സ്വയംഭരണ സ്ഥാപനങ്ങളില്‍ ഓഡിറ്റ് കമ്മീഷൻ,"പ്രൊഫ.ആബിദ് ഹുസൈൻ തങ്ങൾ ശ്രീ. യു.എ.ലത്തീഫ് | ശ്രീ എ കെ എം അഷ്റഫ് | ശ്രീ . പി . ഉബൈദുള്ള : താഴെ കാണുന്ന ചോദ്യങ്ങൾക്കു തദ്ദേശ സ്വയംഭരണം, എക്സൈസ്‌ വകുപ്പ് മന്ത്രി സദയം മറുപടി പറയാമോ? ( എ ) സംസ്ഥാനത്ത് തദ്ദേശ സ്വയംഭരണ സ്ഥാപനങ്ങളുടെ പദ്ധതി നടത്തിപ്പുമായി ബന്ധപ്പെട്ട കമ്മിറ്റികളിൽ വിദഗ്ധരെ ഉൾപ്പെടുത്താറുണ്ടോ; വിശദമാക്കുമോ; ( ബി ) പ്രാദേശിക സർക്കാരുകളുടെ ഓഡിറ്റ് ചുമതല ആരെയാണ് ഏൽപ്പിച്ചിരിക്കുന്നത് എന്ന് അറിയിക്കുമോ; ( സി ) തദ്ദേശ സ്വയംഭരണ സ്ഥാപനങ്ങളിലെ ഓഡിറ്റിംഗിന് സ്വതന്ത്ര സ്വഭാവത്തോടുകൂടിയ ഓഡിറ്റ് കമ്മീഷൻ വേണമെന്ന നിർദേശം പരിശോധിച്ചിട്ടുണ്ടോ; എങ്കിൽ പ്രസ്തുത വിഷയം സംബന്ധിച്ച നിലപാട് വ്യക്തമാക്കുമോ? കുടുംബശ്രീയുടെ റെഡി ടു ഈറ്റ് ഉല്പന്നങ്ങള്‍",,http://www.niyamasabha.org/codes/15kla/Session_8/ans/s00471-160323-08-15.pdf,http://www.niyamasabha.org/codes/15kla/Session_8/qns/html/s_160323(451-480).html,,,,,
15-8-472,15,8,472,starred,2023-03-16,starred,കുടുംബശ്രീയുടെ റെഡി ടു ഈറ്റ് ഉല്പന്നങ്ങള്‍,"ശ്രീമതി കാനത്തില്‍ ജമീല | ശ്രീമതി യു പ്രതിഭ | ശ്രീമതി ശാന്തകുമാരി കെ. | ശ്രീ സി കെ ഹരീന്ദ്രന്‍ : താഴെ കാണുന്ന ചോദ്യങ്ങൾക്കു തദ്ദേശ സ്വയംഭരണം, എക്സൈസ്‌ വകുപ്പ് മന്ത്രി സദയം മറുപടി പറയാമോ? ( എ ) കുടുംബശ്രീ റെഡി ടു ഈറ്റ് ഉല്പന്നങ്ങള്‍ വിപണിയിലെത്തിക്കാന്‍ പദ്ധതി തയ്യാറാക്കിയിട്ടുണ്ടോ; എങ്കില്‍ വിശദാംശം അറിയിക്കാമോ; ( ബി ) കുടുംബശ്രീയുടെ വിവിധ പ്രവര്‍ത്തനങ്ങള്‍ക്കായി ബജറ്റില്‍ നടപ്പ് സാമ്പത്തിക വര്‍ഷം എത്ര തുകയാണ് വകയിരുത്തിയിട്ടുള്ളത്; ( സി ) കുടുംബശ്രീയുടെ സംഘടനാ സംവിധാനം കൂടുതല്‍ വിപുലീകരിക്കുന്നതിനും സംഘങ്ങളുടെയും അംഗങ്ങളുടെയും കാര്യശേഷി വര്‍ദ്ധിപ്പിക്കുന്നതിനും പദ്ധതിയുണ്ടോ എന്ന് അറിയിക്കാമോ? ഹൃദ്രോഗത്തിനും പക്ഷാഘാതത്തിനും അടിയന്തര ചികിത്സ",,http://www.niyamasabha.org/codes/15kla/Session_8/ans/s00472-160323-08-15.pdf,http://www.niyamasabha.org/codes/15kla/Session_8/qns/html/s_160323(451-480).html,,,,,
15-8-473,15,8,473,starred,2023-03-16,starred,ഹൃദ്രോഗത്തിനും പക്ഷാഘാതത്തിനും അടിയന്തര ചികിത്സ,ഡോ. എം.കെ.മുനീർ | ശ്രീ .പി. കെ. ബഷീർ ശ്രീ. കെ. പി. എ. മജീദ് | ശ്രീ എൻ എ നെല്ലിക്കുന്ന് : താഴെ കാണുന്ന ചോദ്യങ്ങൾക്കു ആരോഗ്യ- വനിത-ശിശുവികസന വകുപ്പ് മന്ത്രി സദയം മറുപടി പറയാമോ? ( എ ) സർക്കാർ മെഡിക്കൽ കോളേജുകളിൽ ഹൃദയാഘാതത്തെ തുടര്‍ന്ന് അത്യാഹിത വിഭാഗത്തിൽ എത്തിക്കുന്ന രോഗിക്ക് ചികിത്സ ലഭിക്കാൻ നാല് മണിക്കൂറിലേറെ സമയമെടുക്കുന്നുവെന്ന ആക്ഷേപം ശ്രദ്ധയിൽപ്പെട്ടിട്ടുണ്ടോ; വ്യക്തമാക്കുമോ; ( ബി ) അത്യാഹിത വിഭാഗത്തോട് ചേർന്ന് ഹൃദ്രോഗത്തിനും പക്ഷാഘാതത്തിനും എത്രയും വേഗം ചികിത്സ ലഭ്യമാക്കുന്നതിനായി എന്തെങ്കിലും സംവിധാനം ഒരുക്കാൻ ഉദ്ദേശിക്കുന്നുണ്ടോ; വിശദാംശം നൽകുമോ; ( സി ) മെഡിക്കൽ കോളേജുകളിലെ അത്യാഹിത വിഭാഗത്തിൽ അടിയന്തര ചികിത്സ ലഭ്യമാക്കുന്നതിന് സ്വീകരിക്കാനുദ്ദേശിക്കുന്ന നടപടികൾ എന്തെല്ലാമാണെന്ന് വ്യക്തമാക്കുമോ? സ്കൂൾ ആരോഗ്യ പരിപാടി,,http://www.niyamasabha.org/codes/15kla/Session_8/ans/s00473-160323-08-15.pdf,http://www.niyamasabha.org/codes/15kla/Session_8/qns/html/s_160323(451-480).html,Dr. M K Muneer,Indian Union Muslim League,Koduvally,ഇന്ത്യൻ യൂണിയൻ മുസ്ലീം ലീഗ്,കൊടുവള്ളി
15-8-474,15,8,474,starred,2023-03-16,starred,സ്കൂൾ ആരോഗ്യ പരിപാടി,"ശ്രീ. ഇ കെ വിജയൻ | ശ്രീ ജി എസ് ജയലാൽ ശ്രീ. ഇ. ടി. ടൈസൺ മാസ്റ്റർ ശ്രീ. പി. ബാലചന്ദ്രൻ : താഴെ കാണുന്ന ചോദ്യങ്ങൾക്കു ആരോഗ്യ- വനിത-ശിശുവികസന വകുപ്പ് മന്ത്രി സദയം മറുപടി പറയാമോ? ( എ ) പുതിയ കാല സാമൂഹിക പശ്ചാത്തലത്തിൽ കുട്ടികളുടെ ശാരീരിക, സാമൂഹിക, മാനസിക ആരോഗ്യ വികസനത്തിന് കൂടുതൽ കാര്യക്ഷമമായ ഇടപെടലുകള്‍ നടത്തേണ്ടതിന്റെ ആവശ്യകത ശ്രദ്ധയിൽപ്പെട്ടിട്ടുണ്ടോ; വിശദമാക്കാമോ; ( ബി ) കുട്ടികളുടെ സമഗ്രമായ ശാരീരിക, മാനസിക ആരോഗ്യ വികസനത്തിനായി സ്കൂൾ ആരോഗ്യ പരിപാടി ആവിഷ്കരിക്കുവാന്‍ ആരോഗ്യ വകുപ്പ് തീരുമാനിച്ചിട്ടുണ്ടോ; വിശദമാക്കാമോ; ( സി ) വിദ്യാഭ്യാസ കാലത്ത് തന്നെ സാമൂഹിക വെല്ലുവിളികളെ അതിജീവിച്ച് കഴിവുകൾ വികസിപ്പിക്കുന്നതിന് ഉപകരിക്കുന്ന തരത്തില്‍ പ്രസ്തുത പദ്ധതി നടപ്പാക്കുമോയെന്ന് വ്യക്തമാക്കാമോ; ( ഡി ) പദ്ധതിയുടെ ഭാഗമായി സ്കൂളുകളും സ്ഥലത്തെ കുടുംബാരോഗ്യ കേന്ദ്രങ്ങളും തമ്മിൽ നിരന്തര പ്രവർത്തനബന്ധം ഉണ്ടാക്കുവാനും അദ്ധ്യാപകർക്കും വിദ്യാർത്ഥികൾക്കും പ്രാഥമിക ചികിത്സയിൽ പരിശീലനം നൽകുവാനും തീരുമാനിച്ചിട്ടുണ്ടോയെന്ന് അറിയിക്കാമോ? വടക്കാഞ്ചേരി ലൈഫ് പദ്ധതിയുമായി ബന്ധപ്പെട്ട ചര്‍ച്ച",,http://www.niyamasabha.org/codes/15kla/Session_8/ans/s00474-160323-08-15.pdf,http://www.niyamasabha.org/codes/15kla/Session_8/qns/html/s_160323(451-480).html,E K Vijayan,Communist Party Of India,Nadapuram,കമ്മ്യൂണിസ്റ്റ് പാർട്ടി ഓഫ് ഇന്ത്യ,നാദാപുരം
15-8-475,15,8,475,starred,2023-03-16,starred,വടക്കാഞ്ചേരി ലൈഫ് പദ്ധതിയുമായി ബന്ധപ്പെട്ട ചര്‍ച്ച,ശ്രീമതി കെ.കെ.രമ ഡോ. മാത്യു കുഴല്‍നാടൻ ശ്രീ. റോജി എം. ജോൺ ശ്രീ. സനീഷ്‍കുമാര്‍ ജോസഫ് : താഴെ കാണുന്ന ചോദ്യങ്ങൾക്കു മുഖ്യമന്ത്രി സദയം മറുപടി പറയാമോ? ( എ ) വടക്കാഞ്ചേരിയിൽ ലൈഫ് പദ്ധതിയുടെ ഭാഗമായി റെഡ്ക്രെസന്റ് എന്ന വിദേശ സ്ഥാപനത്തിൽ നിന്നും സഹായം സ്വീകരിക്കുന്നതുമായി ബന്ധപ്പെട്ട് യു.എ.ഇ. കോൺസുലേറ്റ് ജനറലും യു.എ.ഇ. കോൺസുലേറ്റ് ജീവനക്കാരുമായി മുഖ്യമന്ത്രി ഔദ്യോഗിക വസതിയിൽ വച്ച് ചർച്ച നടത്തിയിട്ടുണ്ടോ; ( ബി ) എങ്കിൽ പ്രസ്തുത ചർച്ചയിലെ പ്രധാനപ്പെട്ട തീരുമാനങ്ങൾ എന്തൊക്കെയായിരുന്നു വെന്ന് വിശദമാക്കാമോ; ( സി ) വിദേശ രാജ്യങ്ങളിലെ എംബസി ഉദ്യോഗസ്ഥരുമായി ചർച്ച നടത്തുമ്പോൾ പാലിക്കേണ്ട എന്തൊക്കെ വ്യവസ്ഥകളാണ് പ്രോട്ടോകോൾ ഹാൻഡ്‌ബുക്കില്‍ നിഷ്കർഷിച്ചിരിക്കുന്നതെന്ന് വിശദമാക്കാമോ; ( ഡി ) പ്രസ്തുത ഉദ്യോഗസ്ഥരുമായി ചർച്ച നടത്തുമ്പോൾ പാലിക്കേണ്ട നടപടിക്രമങ്ങൾ മേൽപ്പറഞ്ഞ ചർച്ചയ്ക്ക് പാലിച്ചിട്ടുണ്ടോയെന്ന് വ്യക്തമാക്കാമോ? ജല ബജറ്റ് തയ്യാറാക്കുന്നതിന് നടപടി,,http://www.niyamasabha.org/codes/15kla/Session_8/ans/s00475-160323-08-15.pdf,http://www.niyamasabha.org/codes/15kla/Session_8/qns/html/s_160323(451-480).html,,,,,
15-8-476,15,8,476,starred,2023-03-16,starred,ജല ബജറ്റ് തയ്യാറാക്കുന്നതിന് നടപടി,"ശ്രീ. കെ. ബാബു (നെന്മാറ) | ശ്രീ ഐ ബി സതീഷ് ശ്രീ. കെ.എം.സച്ചിന്‍ദേവ് ശ്രീ. പി.വി. ശ്രീനിജിൻ : താഴെ കാണുന്ന ചോദ്യങ്ങൾക്കു തദ്ദേശ സ്വയംഭരണം, എക്സൈസ്‌ വകുപ്പ് മന്ത്രി സദയം മറുപടി പറയാമോ? ( എ ) സംസ്ഥാനത്ത് ഓരോ പ്രദേശത്തെയും ജല ലഭ്യതയും വിനിയോഗവും അടിസ്ഥാനമാക്കി ജല ബജറ്റ് തയ്യാറാക്കുന്നതിനുള്ള നടപടികള്‍ ആരംഭിച്ചിട്ടുണ്ടോ; തദ്ദേശ സ്വയംഭരണ സ്ഥാപന തലത്തിലാണോ ഇത് തയ്യാറാക്കുന്നത്; ഇന്ത്യയില്‍ ആദ്യമായി ഇത്തരത്തില്‍ ജല ബജറ്റ് തയ്യാറാക്കുന്നത് കേരളത്തിലാണോ; വിശദാംശം ലഭ്യമാക്കാമോ; ( ബി ) പ്രദേശത്തെ ജല ലഭ്യത, ഉപയോഗം, ഭൂഗര്‍ഭ ജലവിതാനം, ജലത്തിന്റെ ദുരുപയോഗം എന്നിവ സംബന്ധിച്ച പഠനം നടത്തി ജല ബജറ്റിന്റെ ഭാഗമായി പദ്ധതികള്‍ തയ്യാറാക്കുന്നുണ്ടോ; എങ്കില്‍ എന്തെല്ലാം കാര്യങ്ങളാണ് ഇതുവഴി ലക്ഷ്യമിടുന്നത്; വിശദാംശം ലഭ്യമാക്കാമോ? പി.എസ്.സി. വഴിയുള്ള നിയമനം",,http://www.niyamasabha.org/codes/15kla/Session_8/ans/s00476-160323-08-15.pdf,http://www.niyamasabha.org/codes/15kla/Session_8/qns/html/s_160323(451-480).html,K Babu (Nemmara),Communist Party Of India(Marxist),Nemmara,കമ്മ്യൂണിസ്റ്റ് പാർട്ടി ഓഫ് ഇന്ത്യ (മാർക്സിസ്റ്റ്),നെന്മാറ
15-8-477,15,8,477,starred,2023-03-16,starred,പി.എസ്.സി. വഴിയുള്ള നിയമനം,ശ്രീ എം എസ് അരുൺ കുമാര്‍ ഡോ.കെ.ടി.ജലീൽ | ശ്രീ വി കെ പ്രശാന്ത് ശ്രീ. എം.വിജിന്‍ : താഴെ കാണുന്ന ചോദ്യങ്ങൾക്കു മുഖ്യമന്ത്രി സദയം മറുപടി പറയാമോ? ( എ ) കഴി‍ഞ്ഞ സര്‍ക്കാരിന്റെ കാലം മുതല്‍ നാളിതുവരെയുള്ള കാലയളവില്‍ പി.എസ്.സി. വഴി നല്‍കിയ നിയമനം ഇക്കാലയളവില്‍ കേന്ദ്ര റിക്രൂട്ടിംഗ് ഏജന്‍സിയായ യു.പി.എസ്.സി. രാജ്യത്താകെ നല്‍കിയ നിയമനത്തേക്കാള്‍ കൂടുതലാണോ എന്ന് പരിശോധിച്ചിട്ടുണ്ടോ; എങ്കില്‍ വിശദമാക്കാമോ; ( ബി ) 2011-16 കാലയളവിലെ സര്‍ക്കാരിന്റെ കാലത്ത് പി.എസ്.സി. വഴി ആകെ നല്‍കിയ നിയമനം എത്രയെന്ന് വ്യക്തമാക്കാമോ? സംസ്ഥാന വനിതാ നയം,,http://www.niyamasabha.org/codes/15kla/Session_8/ans/s00477-160323-08-15.pdf,http://www.niyamasabha.org/codes/15kla/Session_8/qns/html/s_160323(451-480).html,,,,,
